392,E0534800012111,浜口小学校,秋田県三種町浜田字福沢57,1,,,40.1026909875944,139.983714163338,
393,E0534800013111,金岡小学校,秋田県三種町豊岡金田字茂呂沢78-2,1,,,40.1233516649159,140.081217531793,
394,E0520900001121,福祉保健センター,秋田県鹿角市花輪字下花輪50,1,,要配慮者,40.1923300490663,140.792252326355,
395,E0520900001111,福祉保健センター,秋田県鹿角市花輪字下花輪50,1,,,40.1923300490663,140.792252326355,
396,E0520900002111,下川原地域活動センター,秋田県鹿角市花輪字下川原35-4,1,,,40.228605006797,140.78033973178,
397,E0520900003111,旧平元小学校,秋田県鹿角市花輪字源田平6-1,1,,,40.244157486732,140.80479937231,
398,E0520900005121,交流センター,秋田県鹿角市花輪字荒田1-1,1,,要配慮者,40.214707477147,140.78927966586,
399,E0520900005111,交流センター,秋田県鹿角市花輪字荒田1-1,1,,,40.214707477147,140.78927966586,
400,E0520900006112,記念スポーツセンター,秋田県鹿角市花輪字荒田4-1,1,,,40.21484845366,140.7881574456,
401,E0520900006111,山村開発センター,秋田県鹿角市花輪字荒田4-1,1,,,40.215327733541,140.78771756331,
402,E0520900007111,柴平小学校,秋田県鹿角市花輪字高市向35,1,,,40.2353736392168,140.806373839765,
403,E0520900008111,鹿角アメニティパーク倶楽部ハウス,秋田県鹿角市花輪字小坂8-1,1,,,40.203390819459,140.79423203807,
404,E0520900009121,交流プラザ（ＭＩＴプラザ）,秋田県鹿角市花輪字上花輪128-1,1,,要配慮者,40.1879042150936,140.789328248355,
405,E0520900009111,交流プラザ（ＭＩＴプラザ）,秋田県鹿角市花輪字上花輪128-1,1,,,40.1879042150936,140.789328248355,
406,E0520900011111,福祉プラザ,秋田県鹿角市花輪字上中島93,1,,,40.186676622344,140.78596546989,
407,E0520900013111,旧花輪北小学校,秋田県鹿角市花輪字新川端20,1,,,40.222513690905,140.79294412901,
408,E0520900016111,花輪小学校,秋田県鹿角市花輪字中花輪88,1,,,40.189797281691,140.79350258216,
409,E0520900017111,花輪中学校,秋田県鹿角市花輪字陳場125,1,,,40.198562500806,140.79625344954,
410,E0520900018121,文化の杜交流館　コモッセ,秋田県鹿角市花輪字八正寺13,1,,要配慮者,40.192216448597,140.78703457313,
411,E0520900018111,文化の杜交流館　コモッセ,秋田県鹿角市花輪字八正寺13,1,,,40.192216448597,140.78703457313,
412,E0520900019121,柴平地域活動センター,秋田県鹿角市花輪字八幡平12-1,1,,要配慮者,40.241547089278,140.80719274615,
413,E0520900019111,柴平地域活動センター,秋田県鹿角市花輪字八幡平12-1,1,,,40.241547089278,140.80719274615,
414,E0520900020111,鹿角トレーニングセンター（アルパス）,秋田県鹿角市花輪字百合沢81-1,1,,,40.1878608032802,140.822065192614,
415,E0520900021111,鹿角高等学校,秋田県鹿角市花輪字明堂長根12,1,,,40.178165520485,140.79359025054,
416,E0520900023111,錦木地区市民センター,秋田県鹿角市十和田錦木字浜田91-1,1,,,40.253634012172,140.76808876357,
417,E0520900023121,錦木地区市民センター,秋田県鹿角市十和田錦木字浜田91-1,1,,要配慮者,40.253634012172,140.76808876357,
418,E0520900025111,旧草木小学校,秋田県鹿角市十和田草木字大畑70,1,,,40.2678992994276,140.822598600713,
419,E0520900026111,大湯小学校,秋田県鹿角市十和田大湯字権現堂15-1,1,,,40.297472986155,140.82804372067,
420,E0520900027121,大湯地区市民センター,秋田県鹿角市十和田大湯字権現堂22-1,1,,要配慮者,40.29710192602,140.8273047682,
421,E0520900027111,大湯地区市民センター,秋田県鹿角市十和田大湯字権現堂22-1,1,,,40.29710192602,140.8273047682,
422,E0520900029111,大湯温泉総合振興プラザ,秋田県鹿角市十和田大湯字中田23-2,1,,,40.2935695686157,140.826721507472,
423,E0520900031111,旧末広小学校,秋田県鹿角市十和田末広字不動平4-1,1,,,40.2327913547685,140.737050007209,
424,E0520900033111,毛馬内保育園,秋田県鹿角市十和田毛馬内字下小路67,1,,,40.2750837689446,140.765831344755,
425,E0520900035111,十和田小学校,秋田県鹿角市十和田毛馬内字上新田1-1,1,,,40.261950416242,140.77282413702,
426,E0520900036111,十和田中学校,秋田県鹿角市十和田毛馬内字上土ケ久保22-1,1,,,40.265594068274,140.78019218616,
427,E0520900037111,十和田市民センター,秋田県鹿角市十和田毛馬内字城ノ下7-5,1,,,40.269570249929,140.76844761885,
428,E0520900037121,十和田市民センター,秋田県鹿角市十和田毛馬内字城ノ下7-5,1,,要配慮者,40.269570249929,140.76844761885,
429,E0520900040111,八幡平中学校,秋田県鹿角市八幡平字諸田4-1,1,,,40.136991472915,140.79441891667,
430,E0520900041111,八幡平市民センター,秋田県鹿角市八幡平字小豆沢碇114,1,,,40.1384760491186,140.797336236217,
431,E0520900041121,八幡平市民センター,秋田県鹿角市八幡平字小豆沢碇114,1,,要配慮者,40.1384760491186,140.797336236217,
432,E0520900042111,谷内地区市民センター,秋田県鹿角市八幡平字仲の沖100,1,,,40.111327463061,140.7850078272,
433,E0520900042121,谷内地区市民センター,秋田県鹿角市八幡平字仲の沖100,1,,要配慮者,40.111327463061,140.7850078272,
434,E0520900044111,八幡平小学校,秋田県鹿角市八幡平字長嶺川原1,1,,,40.13789245531,140.79713253917,
435,E0520900045111,湯瀬体育館,秋田県鹿角市八幡平字湯瀬一羽根45-2,1,,,40.12030123902,140.840051363,
436,E0520900046121,尾去沢市民センター,秋田県鹿角市尾去沢字軽井沢46-5,1,,要配慮者,40.188157436338,140.76612534413,
437,E0520900046111,尾去沢市民センター,秋田県鹿角市尾去沢字軽井沢46-5,1,,,40.188157436338,140.76612534413,
438,E0520900048111,尾去沢小学校,秋田県鹿角市尾去沢字上山201-1,1,,,40.182917558393,140.77409627497,
439,E0520900050111,尾去沢中学校,秋田県鹿角市尾去沢字上山239-1,1,,,40.184231621363,140.77646085619,
440,E0520100001111,旭南小学校体育館,秋田県秋田市旭南1-15-1,1,,,39.709691,140.10981,
441,E0520100002111,旭南地区コミュニティセンター,秋田県秋田市旭南1-15-5,1,,,39.710123,140.108848,
442,E0520100004111,茨島地区コミュニティセンター,秋田県秋田市茨島1-4-71,1,,,39.70343834,140.1029549,
443,E0520100004112,茨島体育館,秋田県秋田市茨島1-4-71,1,,,39.70397,140.102726,
444,E0520100009111,下新城地区コミュニティセンター,秋田県秋田市下新城笠岡字堰場193-4,1,,,39.799213,140.077671,
445,E0520100010111,下新城小学校体育館,秋田県秋田市下新城笠岡字佐戸反10,1,,,39.800212,140.076592,
446,E0520100248121,障害者支援施設ほくと,秋田県秋田市下新城中野字街道端西11-1,,,市が特定したもの,39.794441,140.059821,
447,E0520100012111,秋田北中学校体育館,秋田県秋田市下新城中野字街道端西241-90,1,,,39.805956,140.054123,
448,E0520100013111,下新城交流センター,秋田県秋田市下新城中野字前谷地263,1,,,39.800221913207,140.06366887368,
449,E0520100016111,下浜地区コミュニティセンター,秋田県秋田市下浜羽川字下野1-76,1,,,39.614659769444,140.06361435582,
450,E0520100021112,下浜小学校体育館,秋田県秋田市下浜羽川字水垂92,1,,,39.613464,140.065143,
451,E0520100021111,旧下浜中学校体育館,秋田県秋田市下浜羽川字水垂92,1,,,39.612826,140.066189,
452,E0520100028111,明桜高等学校体育館,秋田県秋田市下北手桜字守沢8-1,1,,,39.717411,140.160824,
453,E0520100029111,一つ森公園コミュニティ体育館,秋田県秋田市下北手桜字蛭沢141-7,1,,,39.69986744,140.1423039,
454,E0520100030112,旧下北手中学校体育館,秋田県秋田市下北手松崎字走り崎14,1,,,39.722815,140.164506,
455,E0520100031111,旧下北手小学校体育館,秋田県秋田市下北手松崎字谷崎202-1,1,,,39.720759,140.169516,
456,E0520100032111,下北手地区コミュニティセンター,秋田県秋田市下北手柳館字前田面133-1,1,,,39.718174,140.173072,
457,E0520100249121,障害者支援施設秋田ワークセンター,秋田県秋田市下北手柳館字前田面134,,,市が特定したもの,39.718337,140.172307,
458,E0520100034111,東生活改善センター,秋田県秋田市河辺岩見字東49-50,,,,39.709464,140.327437,
459,E0520100035111,戸島小学校体育館,秋田県秋田市河辺戸島字本町123,1,,,39.642164,140.196934,
460,E0520100036111,河辺岩見三内地区コミュニティセンター,秋田県秋田市河辺三内字外川原34-1,1,,,39.70664451,140.2868959,
461,E0520100037111,岩見三内中学校体育館,秋田県秋田市河辺三内字外川原39,1,,,39.707965665047,140.28622609325,
462,E0520100037112,岩見三内小学校体育館,秋田県秋田市河辺三内字外川原39,1,,,39.707610861994,140.28672533995,
463,E0520100038111,秋田市河辺高齢者健康づくりセンター（ユフォーレ体育館）,秋田県秋田市河辺三内字丸舞1-1,1,,,39.741412248124,140.31635655397,
464,E0520100038112,秋田県健康増進交流センター（ユフォーレ）,秋田県秋田市河辺三内字丸舞1-1,1,,,39.742399,140.316136,
465,E0520100039111,砂子渕公民館,秋田県秋田市河辺三内字高畑内63,,,,39.735993,140.328346,
466,E0520100264111,上三内農村集落センター,秋田県秋田市河辺三内字三内段191,,,,39.726785,140.303775,
467,E0520100041111,旧赤平小学校体育館,秋田県秋田市河辺赤平字小曽根80,1,,,39.677138871253,140.25935141601,
468,E0520100042111,河辺総合福祉交流センター,秋田県秋田市河辺北野田高屋字上前田表66-1,1,,,39.65291786,140.2124684,
469,E0520100043111,河辺中学校体育館,秋田県秋田市河辺北野田高屋字雷谷地84,1,,,39.65853,140.21529,
470,E0520100044111,河辺小学校体育館,秋田県秋田市河辺和田字岡村164,,,,39.658104,140.232689,
471,E0520100047111,河辺体育館,秋田県秋田市河辺和田字上中野186,1,,,39.6510083,140.2161943,
472,E0520100048111,河辺市民サービスセンター,秋田県秋田市河辺和田字北条ケ崎38-2,1,,,39.65281986,140.2153119,
473,E0520100049111,外旭川小学校体育館,秋田県秋田市外旭川字梶ノ目262-2,1,,,39.747089,140.109051,
474,E0520100050111,外旭川中学校体育館,秋田県秋田市外旭川字梶ノ目50,1,,,39.748956,140.114308,
475,E0520100051111,外旭川地区コミュニティセンター,秋田県秋田市外旭川字四百刈76,1,,,39.74943362,140.1014446,
476,E0520100056111,南部市民サービスセンター別館,秋田県秋田市牛島東6-4-5,1,,,39.6950101514596,140.124263431615,
477,E0520100057111,牛島小学校体育館,秋田県秋田市牛島東6-6-1,1,,,39.695108,140.126698,
478,E0520100058111,金足地区コミュニティセンター,秋田県秋田市金足小泉字上前55,1,,,39.8231624780798,140.066863583696,
479,E0520100059111,金足西小学校体育館,秋田県秋田市金足大清水字大清水台1,1,,,39.839098,140.0537,
480,E0520100060111,金足農業高等学校第一体育館,秋田県秋田市金足追分字海老穴102-4,1,,,39.816292,140.058598,
481,E0520100250122,げんきハウス下新城,秋田県秋田市金足追分字海老穴222,,,市が特定したもの,39.813988,140.057815,
482,E0520100250121,げんきハウス金足,秋田県秋田市金足追分字海老穴222,,,市が特定したもの,39.813996,140.057804,
483,E0520100062111,旧金足東小学校体育館,秋田県秋田市金足片田字待入109,1,,,39.823814,140.091143,
484,E0520100063111,秋田県中央地区老人福祉総合エリア屋内運動広場ほか１７部屋,秋田県秋田市御所野下堤5-1-1,1,,,39.666659245338,140.15575149206,
485,E0520100251121,障害者支援センター御所野,秋田県秋田市御所野下堤5-1-4,,,市が特定したもの,39.667309,140.156107,
486,E0520100064111,御所野小学校体育館,秋田県秋田市御所野元町5-1-1,1,,,39.660951,140.165347,
487,E0520100065112,御所野学院中学校体育館,秋田県秋田市御所野地蔵田4-1-1,1,,,39.661111,140.155714,
488,E0520100065111,御所野学院高等学校体育館,秋田県秋田市御所野地蔵田4-1-1,1,,,39.660628,140.155741,
489,E0520100067111,南部市民サービスセンター,秋田県秋田市御野場1-5-1,1,,,39.672845,140.135219,
490,E0520100068111,広面小学校体育館,秋田県秋田市広面字蟹沢29,1,,,39.729083,140.144037,
491,E0520100069111,東地区コミュニティセンター,秋田県秋田市広面字鬼頭38,1,,,39.710944,140.141245,
492,E0520100070111,東部市民サービスセンター,秋田県秋田市広面字釣瓶町13-3,1,,,39.724159,140.151926,
493,E0520100071111,城東中学校体育館,秋田県秋田市広面字鍋沼17,1,,,39.715635,140.147319,
494,E0520100073111,桜小学校体育館,秋田県秋田市桜4-12-1,1,,,39.709708,140.154904,
495,E0520100075111,桜中学校体育館,秋田県秋田市桜台1-1-1,1,,,39.711029,140.154777,
496,E0520100076111,桜地区コミュニティセンター（多目的ホール）,秋田県秋田市桜台1-1-4,1,,,39.709512921958,140.15571907536,
497,E0520100078111,中央市民サービスセンター,秋田県秋田市山王1-1-1,1,,,39.71992049714,140.10355997487,
498,E0520100079111,山王中学校体育館,秋田県秋田市山王3-1-24,1,,,39.71748,140.107016,
499,E0520100080111,旭北小学校体育館,秋田県秋田市山王3-1-35,1,,,39.716415,140.106269,
500,E0520100084111,秋田県児童会館,秋田県秋田市山王中島町1-2,1,,,39.717874,140.092502,
501,E0520100085111,四ツ小屋小学校体育館,秋田県秋田市四ツ小屋字街道東256-1,1,,,39.667759,140.138252,
502,E0520100261121,障害者支援施設雄高園,秋田県秋田市四ツ小屋末戸松本字地蔵田268,,,市が特定したもの,39.65644,140.158554,
503,E0520100087111,聖霊女子短期大学,秋田県秋田市寺内高野10-33,,,,39.742964,140.086973,
504,E0520100088111,寺内地区コミュニティセンター,秋田県秋田市寺内神屋敷13-23,1,,,39.73513762,140.0828155,
505,E0520100090111,秋田県青少年交流センター,秋田県秋田市寺内神屋敷3-1,1,,,39.731292,140.081813,
506,E0520100091111,寺内小学校体育館,秋田県秋田市寺内堂ノ沢2-14-1,1,,,39.734531,140.085105,
507,E0520100094111,秋田東中学校体育館,秋田県秋田市手形休下町10-51,1,,,39.727854,140.128248,
508,E0520100095111,旭川地区コミュニティセンター,秋田県秋田市手形字才ノ浜51-2,1,,,39.73821568,140.1328399,
509,E0520100096111,旭川小学校体育館,秋田県秋田市手形字才ノ浜63,1,,,39.738876,140.131711,
510,E0520100097111,秋田高等学校大体育館,秋田県秋田市手形字中台1,1,,,39.735685,140.13406,
511,E0520100098111,明徳地区コミュニティセンター,秋田県秋田市手形住吉町2-27,1,,,39.726078,140.130286,
512,E0520100099111,秋田大学体育館,秋田県秋田市手形住吉町6,1,,,39.726895,140.131597,
513,E0520100100111,将軍野中学校体育館,秋田県秋田市将軍野南1-12-1,1,,,39.745,140.082149,
514,E0520100101111,高清水小学校体育館,秋田県秋田市将軍野南1-2-16,1,,,39.743634,140.083474,
515,E0520100102111,将軍野地区コミュニティセンター,秋田県秋田市将軍野南4-8-8,1,,,39.74707013,140.0864618,
516,E0520100103111,上新城地区コミュニティセンター,秋田県秋田市上新城五十丁字小林88-5,1,,,39.7944507,140.1188779,
517,E0520100104111,旧上新城小学校体育館,秋田県秋田市上新城五十丁字大村屋敷22,1,,,39.795409,140.123131,
518,E0520100105111,上北手小学校体育館,秋田県秋田市上北手猿田字館ノ下38,1,,,39.682508,140.164761,
519,E0520100260121,高清水園,秋田県秋田市上北手猿田字苗代沢14-1,,,市が特定したもの,39.685129,140.1566,
520,E0520100107111,日赤秋田看護・短期大学大体育館,秋田県秋田市上北手猿田字苗代沢17-3,1,,,39.685761512931,140.15415896428,
521,E0520100244111,上北手地区コミュニティセンター,秋田県秋田市上北手猿田字苗代沢37-1,1,,,39.685463,140.158955,
522,E0520100108111,秋田県ゆとり生活創造センター（遊学舎）,秋田県秋田市上北手荒巻字堺切24-2,,,,39.688678,140.149314,
523,E0520100109111,栗田支援学校体育館,秋田県秋田市新屋栗田町10-10,1,,,39.688467,140.078915,
524,E0520100109121,秋田県立栗田支援学校,秋田県秋田市新屋栗田町10-10,1,,在校生、卒業生及び事前に市が特定したもの,39.687614,140.078134,
525,E0520100110111,日新小学校体育館,秋田県秋田市新屋栗田町24-1,1,,,39.685644,140.080947,
526,E0520100112111,秋田商業高等学校,秋田県秋田市新屋勝平台1-1,1,,,39.708727374786,140.07598632698,
527,E0520100113111,勝平地区コミュニティセンター,秋田県秋田市新屋松美ガ丘東町10-10,1,,,39.701220107386,140.08404308466,
528,E0520100115111,勝平小学校体育館,秋田県秋田市新屋松美ガ丘北町14-1,1,,,39.706807,140.079218,
529,E0520100117111,西部市民サービスセンター多目的ホール,秋田県秋田市新屋扇町13-34,1,,,39.677232,140.085385,
530,E0520100118112,秋田公立美術大学附属高等学院体育館,秋田県秋田市新屋大川町12-3,1,,,39.685972745405,140.09160839021,
531,E0520100118111,秋田公立美術大学,秋田県秋田市新屋大川町12-3,1,,,39.685662,140.091445,
532,E0520100119111,秋田西中学校体育館,秋田県秋田市新屋大川町19-75,1,,,39.685109,140.088439,
533,E0520100123111,勝平中学校体育館,秋田県秋田市新屋北浜町13-1,1,,,39.702358,140.073826,
534,E0520100124111,大住小学校体育館,秋田県秋田市仁井田字西潟敷33,1,,,39.688619,140.113154,
535,E0520100125111,御野場中学校体育館,秋田県秋田市仁井田字中新田223,1,,,39.677517,140.118961,
536,E0520100126111,仁井田地区コミュニティセンター,秋田県秋田市仁井田本町4-5-20,1,,,39.679446,140.130569,
537,E0520100127111,仁井田小学校体育館,秋田県秋田市仁井田本町4-7-1,1,,,39.679161,140.126958,
538,E0520100128111,秋田南高等学校第１・２体育館,秋田県秋田市仁井田緑町4-1,1,,,39.691391,140.119979,
539,E0520100130111,明徳小学校体育館,秋田県秋田市千秋公園1-13,1,,,39.724762,140.123223,
540,E0520100131111,秋田北高等学校第一体育館,秋田県秋田市千秋中島町8-1,1,,,39.727218,140.121292,
541,E0520100132111,秋田令和高等学校体育館,秋田県秋田市千秋矢留町4-17,,,,39.720833,140.120996,
542,E0520100253121,秋田聖徳会障害福祉サポートセンター聖和,秋田県秋田市川元小川町1-8,,,市が特定したもの,39.7075,140.103903,
543,E0520100133111,川尻地区コミュニティセンター,秋田県秋田市川尻みよし町8-16,1,,,39.71097589,140.0971097,
544,E0520100134111,川尻小学校体育館,秋田県秋田市川尻みよし町8-31,1,,,39.711686,140.096481,
545,E0520100254121,ウエルビューいずみ障がい福祉サービスセンター,秋田県秋田市泉菅野2-17-27,,,市が特定したもの,39.735331,140.116577,
546,E0520100141111,泉小学校体育館,秋田県秋田市泉中央6-2-1,1,,,39.731337,140.109127,
547,E0520100143111,泉地区コミュニティセンター,秋田県秋田市泉北1-20-27,1,,,39.73430762,140.1035369,
548,E0520100144111,泉中学校体育館,秋田県秋田市泉北2-6-1,1,,,39.734749,140.105744,
549,E0520100145111,旧山谷小学校体育館,秋田県秋田市太平山谷字中山谷143,1,,,39.731693623547,140.26123855952,
550,E0520100146111,太平地区コミュニティセンター,秋田県秋田市太平目長崎字沼田42,1,,,39.73060725,140.1989701,
551,E0520100147111,旧太平小学校体育館,秋田県秋田市太平目長崎字上目長崎144,1,,,39.731325,140.19652,
552,E0520100149111,大住地区コミュニティセンター,秋田県秋田市大住南2-7-24,1,,,39.686181,140.109964,
553,E0520100150111,旭北地区コミュニティセンター,秋田県秋田市大町4-4-15,1,,,39.716184,140.114277,
554,E0520100152111,秋田市にぎわい交流館ＡＵ（１階オープンスペース及び交流スペース）,秋田県秋田市中通1-4-1,,,,39.7174819134042,140.122091815016,
555,E0520100153111,中通小学校体育館,秋田県秋田市中通5-8-22,1,,,39.714001,140.121487,
556,E0520100158111,北部市民サービスセンター体育館,秋田県秋田市土崎港西5-3-1,1,,,39.760714358632,140.06531108465,
557,E0520100163111,土崎小学校体育館,秋田県秋田市土崎港中央3-1-78,1,,,39.754856,140.071352,
558,E0520100169111,土崎南小学校体育館,秋田県秋田市土崎港東1-6-39,1,,,39.749787,140.07682,
559,E0520100171111,秋田中央高等学校体育館棟,秋田県秋田市土崎港南3-2-78,1,,,39.745453,140.077413,
560,E0520100173111,土崎中学校体育館,秋田県秋田市土崎港北1-3-1,1,,,39.759569,140.075926,
561,E0520100175111,港北地区コミュニティセンター,秋田県秋田市土崎港北3-7-9,1,,,39.765035518154,140.08236791534,
562,E0520100176111,港北小学校体育館,秋田県秋田市土崎港北4-6-1,1,,,39.763758,140.076383,
563,E0520100177111,東小学校体育館,秋田県秋田市東通2-11-1,1,,,39.715052,140.140818,
564,E0520100179111,秋田市民交流プラザ,秋田県秋田市東通仲町4-1,1,,,39.71584,140.1312655,
565,E0520100179121,障害者支援施設ひだまり,秋田県秋田市東通仲町4-1,1,,市が特定したもの,39.715977,140.131254,
566,E0520100180111,築山小学校体育館,秋田県秋田市楢山古川新町55-1,1,,,39.705578,140.122398,
567,E0520100181111,城南中学校体育館,秋田県秋田市楢山城南町4-1,1,,,39.699562,140.129572,
568,E0520100182111,楢山地区コミュニティセンター,秋田県秋田市楢山南中町1-9,1,,,39.70829989,140.1177182,
569,E0520100183111,秋田県立きらり支援学校体育館,秋田県秋田市南ケ丘1-1-1,1,,,39.690271,140.157087,
570,E0520100183121,秋田県立視覚支援学校,秋田県秋田市南ケ丘1-1-1,1,,在校生、卒業生及び事前に市が特定したもの,39.689901,140.157304,
571,E0520100183122,秋田県立聴覚支援学校,秋田県秋田市南ケ丘1-1-1,1,,在校生、卒業生及び事前に市が特定したもの,39.68981,140.158352,
572,E0520100183123,秋田県立秋田きらり支援学校,秋田県秋田市南ケ丘1-1-1,1,,在校生、卒業生及び事前に市が特定したもの,39.690281,140.158301,
573,E0520100185111,秋田南中学校体育館,秋田県秋田市南通宮田15-1,1,,,39.707774,140.127128,
574,E0520100187111,県立体育館,秋田県秋田市八橋運動公園1-12,,,,39.719481,140.093946,
575,E0520100188111,秋田県スポーツ科学センター,秋田県秋田市八橋運動公園1-5,,,,39.72008,140.098234,
576,E0520100191111,八橋小学校体育館,秋田県秋田市八橋大沼町7-1,1,,,39.731936,140.09636,
577,E0520100193111,八橋地区コミュニティセンター,秋田県秋田市八橋本町5-2-27,1,,,39.725204993024,140.09584127116,
578,E0520100198111,飯島中学校体育館,秋田県秋田市飯島字田尻堰越48,1,,,39.773045,140.084524,
579,E0520100199111,飯島南地区コミュニティセンター（多目的ホール）,秋田県秋田市飯島字南場掛318-2,1,,,39.7684478558683,140.094287063684,
580,E0520100203111,飯島地区コミュニティセンター,秋田県秋田市飯島松根東町5-22,1,,,39.77208426,140.073237,
581,E0520100204111,飯島南小学校体育館,秋田県秋田市飯島西袋1-1-2,1,,,39.767638,140.091249,
582,E0520100206111,飯島小学校体育館,秋田県秋田市飯島鼠田2-2-1,1,,,39.778966,140.072475,
583,E0520100255121,指定相談支援事業所クローバー,秋田県秋田市飯島道東2-13-20,,,市が特定したもの,39.780838,140.066677,
584,E0520100208111,秋田工業高等専門学校第１・２体育館,秋田県秋田市飯島文京町1-1,1,,,39.772244,140.079085,
585,E0520100211111,大森山老人と子どもの家,秋田県秋田市浜田字出小屋333-1,1,,,39.67096419,140.0725867,
586,E0520100215111,聖園学園短期大学,秋田県秋田市保戸野すわ町1-58,,,,39.723107054723,140.11407120371,
587,E0520100216111,保戸野小学校体育館,秋田県秋田市保戸野すわ町9-60,1,,,39.724658,140.115619,
588,E0520100217111,秋田工業高等学校体育館,秋田県秋田市保戸野金砂町3-1,1,,,39.731769,140.121777,
589,E0520100218111,秋田大学附属小学校,秋田県秋田市保戸野原の町13-1,,,,39.727353,140.113613,
590,E0520100219111,秋田大学附属中学校第１・２体育館,秋田県秋田市保戸野原の町7-75,1,,,39.726368,140.115233,
591,E0520100220111,保戸野地区コミュニティセンター,秋田県秋田市保戸野中町6-12,1,,,39.724350481566,140.11799964418,
592,E0520100221111,新屋高等学校体育館,秋田県秋田市豊岩石田坂字鎌塚77-3,1,,,39.667080911535,140.0952875582,
593,E0520100222111,豊岩地区コミュニティセンター,秋田県秋田市豊岩豊巻字内縄尻224-1,1,,,39.649673,140.1136,
594,E0520100224111,旧豊岩中学校体育館,秋田県秋田市豊岩豊巻字内縄尻90-2,1,,,39.64805,140.1121,
595,E0520100256121,障害者支援施設竹生寮,秋田県秋田市柳田字竹生168,,,市が特定したもの,39.732947,140.162186,
