596,E0520100257121,障害者福祉サービス事業所ほっとばんぶー,秋田県秋田市柳田字竹生168-1,,,市が特定したもの,39.732134,140.161911,
597,E0520100258121,柳田新生寮,秋田県秋田市柳田字竹生197,,,市が特定したもの,39.732063,140.164358,
598,E0520100227111,旧大正寺小学校体育館,秋田県秋田市雄和新波字寺沢32-8,1,,,39.525705,140.235261,
599,E0520100229111,雄和基幹集落センター（大正寺連絡所）,秋田県秋田市雄和新波字樋口62-2,1,,,39.52604417,140.2343228,
600,E0520100231111,雄和南体育館,秋田県秋田市雄和神ケ村字陳笠259,1,,,39.525154,140.231429,
601,E0520100233111,雄和小学校体育館,秋田県秋田市雄和石田字蟹沢40,1,,,39.593056199076,140.17051976298,
602,E0520100233112,雄和中学校体育館,秋田県秋田市雄和石田字蟹沢40,1,,,39.59355,140.171334,
603,E0520100235111,秋田県農業試験場講堂・職員会館,秋田県秋田市雄和相川字源八沢34-1,1,,,39.574892,140.195672,
604,E0520100236111,雄和サイクリングターミナル,秋田県秋田市雄和椿川字奥椿岱145-2,1,,,39.627384,140.195959,
605,E0520100238111,旧川添小学校体育館,秋田県秋田市雄和椿川字長者屋敷36-1,1,,,39.621119,140.158178,
606,E0520100239111,長者やま荘（雄和地区北部コミュニティ施設）,秋田県秋田市雄和椿川字長者屋敷38-1,1,,,39.62082258,140.1578628,
607,E0520100241111,雄和市民サービスセンター,秋田県秋田市雄和妙法字上大部48-1,1,,,39.591203,140.170592,
608,E0520100242111,雄和体育館,秋田県秋田市雄和妙法字上大部95-1,1,,,39.591548,140.168856,
609,E0530300001111,七滝活性化拠点センター,秋田県小坂町荒谷字上ノ平27-1,1,,,40.296350765031,140.7644939543,
610,E0530300002111,七滝コミュニティセンター,秋田県小坂町荒谷字沢ノ口16-1,,,,40.295600376304,140.7595700252,
611,E0530300024111,十和田出張所,秋田県小坂町十和田湖字生出1-2,1,,,40.41807,140.857051,
612,E0530300025111,十和田ふるさとセンター,秋田県小坂町十和田湖字大川岱45-1,,,,40.455201,140.843075,
613,E0530300008111,川上公民館,秋田県小坂町小坂字下川原28-2,,,,40.36711733873,140.73001457629,
614,E0530300012111,小坂町交流センター,秋田県小坂町小坂字砂森7-1,,,,40.325537601199,140.74191542425,
615,E0530300014111,小坂町福祉保健総合センター,秋田県小坂町小坂字上前田7-1,,,,40.327849,140.740609,
616,E0530300014121,小坂町福祉保健総合センター,秋田県小坂町小坂字上前田7-1,,,要配慮者,40.327780822816,140.74057762029,
617,E0530300015111,小坂マリア園,秋田県小坂町小坂字上前田7-9,,,,40.327543626241,140.74008945826,
618,E0530300017111,向陽体育館,秋田県小坂町小坂字上谷地41-1,,,,40.333377358369,140.73594870471,
619,E0530300018111,障害者支援施設　あすなろ,秋田県小坂町小坂字仁吾平16,,,,40.390526603231,140.74655698441,
620,E0530300020111,小坂中学校,秋田県小坂町小坂字赤神4-1,1,,,40.325073844228,140.74311810936,
621,E0530300020112,小坂小学校,秋田県小坂町小坂字赤神4-1,1,,,40.325509401512,140.74371087754,
622,E0530300021111,障害者支援施設　更望園,秋田県小坂町小坂字大石平45,,,,40.389972122468,140.74934490158,
623,E0530300023111,孫左衛門,秋田県小坂町上向字藤原35-3,,,,40.356616220825,140.78211918742,
624,E0532700005111,若者センター,秋田県上小阿仁村沖田面字野中278-7,1,,,40.046291162618,140.28335348704,
625,E0532700010111,開発センター,秋田県上小阿仁村小沢田字向川原118,1,,,40.063510518721,140.29555919311,
626,E0532700028111,生涯学習センター,秋田県上小阿仁村小沢田字向川原60-3,1,,,40.063913,140.297949,
627,E0532700014111,集住型宿泊交流拠点施設,秋田県上小阿仁村小沢田字向川原72-2,1,,,40.0616086232909,140.296449470712,
628,E0532700016111,保健センター,秋田県上小阿仁村小沢田字向川原80,1,,,40.064755,140.296786,
629,E0532700017111,上小阿仁小・中学校,秋田県上小阿仁村小沢田字上ノ岱97,1,,,40.060572405086,140.29332057572,
630,E0532700019111,杉花交流センター,秋田県上小阿仁村杉花字杉花33-4,1,,,40.066045129968,140.30168370342,
631,E0532700023111,い樹い樹交流センター,秋田県上小阿仁村福舘字村岱43,1,,,40.057421704298,140.29556455753,
632,E0532700030111,羽立集会施設,秋田県上小阿仁村仏社字羽立台22-5,1,,,40.076684,140.312997,
633,E0521500003111,雲沢集落センター,秋田県仙北市角館町雲然田中437-13,1,,,39.585475594054,140.54031815052,
634,E0521500004111,角館西保育園,秋田県仙北市角館町雲然田中437-2,1,,,39.586041950788,140.54040399203,
635,E0521500005111,下延コミュニティセンター,秋田県仙北市角館町下延段添198,1,,,39.563831666683,140.5342685754,
636,E0521500010111,秋田県立角館高等学校,秋田県仙北市角館町細越町37,1,,,39.60331597779,140.56492299255,
637,E0521500012111,秋田県立大曲支援学校せんぼく校,秋田県仙北市角館町小館77-2,1,,,39.590007327247,140.56104408786,
638,E0521500013111,角館中学校,秋田県仙北市角館町小勝田小倉前73,1,,,39.596740122601,140.55514264295,
639,E0521500015121,かくのだて桜苑,秋田県仙北市角館町菅沢15-1,,,要配慮者,39.589672,140.576341,
640,E0521500016111,花葉館,秋田県仙北市角館町西長野古米沢30-19,1,,,39.620388536086,140.47646951687,
641,E0521500017111,西長野交流センター,秋田県仙北市角館町西長野中泊402,1,,,39.609538476541,140.50626608919,
642,E0521500019111,角館小学校,秋田県仙北市角館町西野川原56-1,1,,,39.590320422496,140.55528211783,
643,E0521500020111,中川保育園,秋田県仙北市角館町川原羽黒堂324-1,1,,,39.621518258175,140.55124051779,
644,E0521500021111,中川コミュニティセンター,秋田県仙北市角館町川原中道41,1,,,39.623536906924,140.55500296626,
645,E0521500024111,健康管理センター,秋田県仙北市角館町中菅沢77-28,1,,,39.59039534214,140.56888395352,
646,E0521500025111,角館交流センター,秋田県仙北市角館町中菅沢77-30,1,,,39.591262952752,140.5689908881,
647,E0521500026111,角館こども園,秋田県仙北市角館町中菅沢91-1,1,,,39.590733785203,140.5673172005,
648,E0521500091121,角館寿楽荘,秋田県仙北市角館町白岩上西野87-3,,,要配慮者,39.585132,140.611203,
649,E0521500032111,白岩小百合保育園,秋田県仙北市角館町白岩上西野93-1,1,,,39.585401874845,140.61047118476,
650,E0521500033111,白岩小学校,秋田県仙北市角館町白岩新西野162,1,,,39.58650298,140.607775,
651,E0521500034111,八割コミュニティセンター,秋田県仙北市角館町八割西ケ沢195,1,,,39.579113131569,140.52085393113,
652,E0521500035111,角館樺細工伝承館,秋田県仙北市角館町表町下丁10-1,1,,,39.599596346533,140.56103277396,
653,E0521500038111,角館公民館,秋田県仙北市角館町表町上丁6,1,,,39.602615074071,140.56064710575,
654,E0521500040111,活性化施設　かたくり館,秋田県仙北市西木町小山田字八津249-1,1,,,39.689405749156,140.55363081569,
655,E0521500042111,西明寺中学校,秋田県仙北市西木町上荒井字橋元280-1,,,,39.66277444068,140.57259790699,
656,E0521500043112,仙北市役所西木庁舎,秋田県仙北市西木町上荒井字古堀田47,1,,,39.656072,140.571495,
657,E0521500043111,西木総合開発センター,秋田県仙北市西木町上荒井字古堀田47,1,,,39.656065540262,140.5717610688,
658,E0521500046111,多世代交流施設　西木山鳩館,秋田県仙北市西木町上桧木内字大森37,1,,,39.814422463956,140.58788049553,
659,E0521500047111,紙風船館,秋田県仙北市西木町上桧木内字大地田3-1,1,,,39.815456709078,140.58416831825,
660,E0521500092121,愛仙の華,秋田県仙北市西木町西荒井字番屋94,,,要配慮者,39.633459,140.570803,
661,E0521500050111,西木総合健康増進センター,秋田県仙北市西木町桧木内字吉田123,1,,,39.748384041736,140.59797095454,
662,E0521500052111,桧木内小学校,秋田県仙北市西木町桧木内字高屋110,1,,,39.740660985963,140.58946687172,
663,E0521500053111,桧木内中学校,秋田県仙北市西木町桧木内字高屋2-3,1,,,39.741989206434,140.59191841076,
664,E0521500054121,清流苑,秋田県仙北市西木町桧木内字松葉232,1,,要配慮者,39.743189,140.59102,
665,E0521500054111,西木林業総合センター,秋田県仙北市西木町桧木内字松葉232,1,,,39.743684,140.591352,
666,E0521500055111,桧木内地区公民館,秋田県仙北市西木町桧木内字松葉290-1,1,,,39.741627641236,140.59368168726,
667,E0521500058121,にしき園,秋田県仙北市西木町門屋字屋敷田100,,,要配慮者,39.659952,140.565661,
668,E0521500059111,西木温泉クリオン,秋田県仙北市西木町門屋字屋敷田83-2,1,,,39.661293021802,140.56640742391,
669,E0521500060111,西木コミュニティセンター体育館,秋田県仙北市西木町門屋字屋敷田84,1,,,39.660999,140.566421,
670,E0521500060112,西木コミュニティセンター,秋田県仙北市西木町門屋字屋敷田84,1,,,39.661007,140.566764,
671,E0521500061111,西明寺小学校,秋田県仙北市西木町門屋字六本杉6,1,,,39.654347465328,140.56706719201,
672,E0521500063111,就業改善センター,秋田県仙北市田沢湖神代字古館野404-1,1,,,39.622413289507,140.5975412824,
673,E0521500064111,神代小学校,秋田県仙北市田沢湖神代字珍重屋敷48,1,,,39.621516319932,140.60095209073,
674,E0521500065112,神代中学校,秋田県仙北市田沢湖神代字野中清水244,1,,,39.62247,140.599484,
675,E0521500066111,神代市民体育館,秋田県仙北市田沢湖神代字野中清水259,1,,,39.622569989951,140.59821087309,
676,E0521500067111,神代武道館,秋田県仙北市田沢湖神代字野中清水283-2,1,,,39.62223280085,140.5985242154,
677,E0521500093121,ショートステイ田沢湖,秋田県仙北市田沢湖生保内字街道ノ上80-2,,,要配慮者,39.700162,140.7270195,
678,E0521500068111,田沢湖総合開発センター,秋田県仙北市田沢湖生保内字宮ノ後27,1,,,39.700109073334,140.73153007218,
679,E0521500083111,仙北市役所田沢湖庁舎,秋田県仙北市田沢湖生保内字宮ノ後30,1,,,39.700298,140.731995,
680,E0521500069121,田沢の郷,秋田県仙北市田沢湖生保内字上清水698,,,要配慮者,39.699331,140.715736,
681,E0521500072111,田沢湖健康増進センター,秋田県仙北市田沢湖生保内字浮世坂20,1,,,39.698805319559,140.72184471242,
682,E0521500073113,生保内市民体育館,秋田県仙北市田沢湖生保内字武蔵野105-1,1,,,39.70515254045,140.73128599116,
683,E0521500073114,生保内中学校,秋田県仙北市田沢湖生保内字武蔵野105-1,1,,,39.703295332753,140.73044109531,
684,E0521500073112,生保内武道館,秋田県仙北市田沢湖生保内字武蔵野105-1,1,,,39.705330004347,140.73089975305,
685,E0521500073111,仙北市民会館,秋田県仙北市田沢湖生保内字武蔵野105-1,1,,,39.705285950426,140.7295456106,
686,E0521500074111,生保内小学校,秋田県仙北市田沢湖生保内字武蔵野111,1,,,39.70393504327,140.72832215019,
687,E0521500078111,田沢市民体育館,秋田県仙北市田沢湖田沢字高屋59,1,,,39.768721996836,140.69007467894,
688,E0521500080121,たざわこ清眺苑,秋田県仙北市田沢湖田沢字春山148-1,1,,要配慮者,39.731347,140.70032,
689,E0521500081111,田沢交流センター,秋田県仙北市田沢湖田沢字大山7,1,,,39.767269981933,140.69408376334,
690,E0536800003121,特別養護老人ホームひだまり園,秋田県大潟村西3-3,,,高齢者,40.025236,139.955817,
691,E0536800007111,放課後児童クラブプレイルーム,秋田県大潟村中央5-1,1,,,40.022625,139.959093,
692,E0536800007112,大潟中学校,秋田県大潟村中央5-1,1,,,40.023932849757,139.95988055667,
693,E0536800007113,大潟小学校,秋田県大潟村中央5-1,1,,,40.023924633874,139.95960160694,
694,E0536800012121,大潟村ふれあい健康館,秋田県大潟村北1-3,,,高齢者,40.026436,139.954403,
695,E0536800012112,ポルダー潟の湯,秋田県大潟村北1-3,,,,40.026822,139.954559,
696,E0536800012111,ホテルサンルーラル大潟,秋田県大潟村北1-3,,,,40.027751,139.95429,
697,E0520400001111,上川沿小学校,秋田県大館市餌釣字前田75,1,,,40.24791993,140.5731006,
698,E0520400002111,成章中学校,秋田県大館市猿間字中谷地10,1,,,40.21804159,140.6701561,
699,E0520400003111,十二所体育館,秋田県大館市猿間字長漕６１－２外,1,,,40.21805349,140.6678787,
700,E0520400004121,特別養護老人ホーム　大館南ガーデン,秋田県大館市下川原字向野17-1,,,要配慮者,40.2444647911039,140.524781475035,
701,E0520400005111,南小学校,秋田県大館市下川原字向野6,1,,,40.24516516,140.5255908,
702,E0520400007111,旧天下町児童館,秋田県大館市下代野字天下道下1-150,1,,,40.29440967,140.5852105,
703,E0520400008111,花岡総合スポーツ公園体育館,秋田県大館市花岡町字アセ石33,1,,,40.3173738791131,140.552383730544,
704,E0520400010111,花岡小学校,秋田県大館市花岡町字根井下22,1,,,40.33113188,140.5555081,
705,E0520400011121,特別養護老人ホーム　神山荘,秋田県大館市花岡町字神山6-2,,,要配慮者,40.3230325990075,140.555556935151,
706,E0520400012111,花岡公民館,秋田県大館市花岡町字前田102-3,1,,,40.3284407,140.5535113,
707,E0520400013111,大館市児童発達支援センターひまわり,秋田県大館市花岡町字前田181-5,1,,,40.32542842,140.554699,
708,E0520400014111,旧花岡中学校,秋田県大館市花岡町字前田202-1,1,,,40.32734121,140.5560238,
709,E0520400016121,特別養護老人ホーム　長慶荘,秋田県大館市岩瀬字羽貫谷地中島21-90,,,要配慮者,40.2900384240766,140.451258712806,
710,E0520400017111,田代公民館越山分館,秋田県大館市岩瀬字越山向岱77-5,1,,,40.34738301,140.4656496,
711,E0520400019111,田代中学校,秋田県大館市岩瀬字下軽石野2-2,1,,,40.27719134,140.4583777,
712,E0520400020111,たしろ保育園,秋田県大館市岩瀬字上岩瀬上野19,1,,,40.2937477,140.4539465,
713,E0520400021121,田代いきいきふれあいセンター,秋田県大館市岩瀬字上岩瀬塚ノ岱16,,,要配慮者,40.29373967,140.4517502,
714,E0520400022111,山瀬小学校,秋田県大館市岩瀬字上軽石野39-18,1,,,40.27833249,140.4592991,
715,E0520400023112,田代公民館赤川分館,秋田県大館市岩瀬字赤川20,1,,,40.29790779,140.4624538,
716,E0520400023111,障害者生活支援センター,秋田県大館市岩瀬字赤川20,1,,,40.29844376,140.4624002,
717,E0520400024111,田代公民館岩瀬分館,秋田県大館市岩瀬字大柳95-6,1,,,40.27372685,140.4675107,
718,E0520400025121,障害者支援施設　軽井沢福祉園,秋田県大館市軽井沢字鳶ケ長根1-32,,,要配慮者,40.219646019897,140.642471837115,
719,E0520400031111,城西体育館,秋田県大館市根下戸新町6-20,1,,,40.27264407,140.5343661,
720,E0520400032121,特別養護老人ホーム　山館苑,秋田県大館市山館字館ノ下12-1,,,要配慮者,40.237123256561,140.583591571383,
721,E0520400033111,旧山田小学校体育館,秋田県大館市山田字寺下24,1,,,40.30327989,140.4801408,
722,E0520400034111,田代公民館山田分館,秋田県大館市山田字寺下42,1,,,40.30312418,140.4818133,
723,E0520400167121,特別養護老人ホーム　水交苑,秋田県大館市字下綱22-1,,,要配慮者,40.289417,140.589767,
724,E0520400035111,大館鳳鳴高等学校※土砂災害時不可,秋田県大館市字金坂後6,1,,,40.27338914,140.5729307,
725,E0520400036111,城南小学校,秋田県大館市字桜町9,1,,,40.26988331,140.5659723,
726,E0520400037111,中央公民館,秋田県大館市字桜町南45-1,1,,,40.2686774,140.5657121,
727,E0520400038111,城南保育園,秋田県大館市字桜町南45-3,1,,,40.26878751,140.5669652,
728,E0520400039111,城南保育園分園,秋田県大館市字水門前124,1,,,40.27693409,140.5627764,
729,E0520400040111,秋田職業能力開発短期大学校,秋田県大館市字扇田道下6-1,1,,,40.26397134,140.5718046,
730,E0520400048112,老人いこいの家（清和荘）,秋田県大館市釈迦内字獅子ケ森1-1,,,,40.301642,140.580871,
731,E0520400050111,釈迦内公民館,秋田県大館市釈迦内字上大留6,1,,,40.3040555,140.5594178,
732,E0520400051112,釈迦内児童センター,秋田県大館市釈迦内字相染台24,1,,,40.308605,140.5655925,
733,E0520400051111,釈迦内小学校,秋田県大館市釈迦内字相染台24,1,,,40.30903044,140.5651795,
734,E0520400051113,釈迦内保育園,秋田県大館市釈迦内字相染台24,1,,,40.30838001,140.5658715,
735,E0520400052111,釈迦内体育館,秋田県大館市釈迦内字台野道上１０－１外,1,,,40.30088039,140.5727063,
736,E0520400053111,北陽中学校,秋田県大館市釈迦内字長者森1,1,,,40.32491856,140.5762578,
737,E0520400054121,介護老人保健施設　成寿苑,秋田県大館市釈迦内字狼穴79,,,要配慮者,40.3117340345824,140.572982623071,
738,E0520400055111,十二所公民館,秋田県大館市十二所字元館1-1,1,,,40.21542255,140.6713809,
739,E0520400056111,湯夢湯夢の里,秋田県大館市十二所字後田34,1,,,40.21147998,140.6458357,
740,E0520400057121,特別養護老人ホーム　つくし苑,秋田県大館市十二所字大水口4-5,,,要配慮者,40.21576533,140.6581265,
741,E0520400058111,成章小学校,秋田県大館市十二所字大平190,1,,,40.21648869,140.6627345,
742,E0520400059111,北部老人福祉総合エリア,秋田県大館市十二所字平内新田237-1,1,,,40.215622,140.655472,
743,E0520400060111,十二所保育園,秋田県大館市十二所字片町21-6,1,,,40.21471441,140.669761,
744,E0520400061113,真中公民館,秋田県大館市出川字上野30,1,,,40.25251248,140.5050039,
745,E0520400061111,真中農林業多目的研修集会施設,秋田県大館市出川字上野30,1,,,40.25201504,140.50491,
746,E0520400061112,旧真中保育所,秋田県大館市出川字上野30,1,,,40.25153807,140.5061733,
747,E0520400062111,旧松峰児童館,秋田県大館市松峰字松峰仁王田１０２－１外,1,,,40.30646805,140.5479691,
748,E0520400065111,大館国際情報学院高等学校,秋田県大館市松木字大上25-1,1,,,40.29110679,140.5551613,
749,E0520400065112,大館国際情報学院中学校,秋田県大館市松木字大上25-1,1,,,40.29043648,140.555372,
750,E0520400066111,沼館保育所,秋田県大館市沼館字神田表111,1,,,40.28786655,140.5389434,
751,E0520400067111,沼館町内（温泉）会館,秋田県大館市沼館字藤蕪82,1,,,40.28509784,140.5400677,
752,E0520400068111,大館樹海ドーム（ニプロハチ公ドーム）,秋田県大館市上代野字稲荷台1-1,1,,,40.2926355,140.5867356,
753,E0520400069111,長木公民館,秋田県大館市上代野字八幡岱24-1,1,,,40.29253564,140.593316,
754,E0520400070111,樹海体育館（タクミアリーナ）,秋田県大館市上代野字八幡岱29-4,1,,,40.29346726,140.5922735,
755,E0520400071111,長木小学校,秋田県大館市上代野字八幡岱45,1,,,40.29379351,140.5942674,
756,E0520400072111,長木保育所,秋田県大館市上代野字八幡岱47,1,,,40.29316017,140.5949375,
757,E0520400074111,城西小学校,秋田県大館市城西町8-1,1,,,40.26906213,140.5434957,
758,E0520400075111,桂城小学校,秋田県大館市水門町1-12,1,,,40.2762803,140.5557552,
759,E0520400076111,桂城児童センター,秋田県大館市水門町1-5,1,,,40.27646038,140.5566994,
760,E0520400078111,秋田看護福祉大学,秋田県大館市清水2-3-4,1,,,40.2809109,140.5534685,
761,E0520400079111,長木公民館雪沢分館,秋田県大館市雪沢字上谷地55-3,1,,,40.29130287,140.6906893,
762,E0520400080111,東光鉄工株式会社雪沢テクノパーク体育館,秋田県大館市雪沢字蕷ケ岱256-1,1,,,40.2843254204252,140.682401974617,
763,E0520400081111,下川沿保育所,秋田県大館市川口字蟹沢1-30,1,,,40.27923962,140.4952239,
764,E0520400082111,下川沿公民館,秋田県大館市川口字隼人岱108-55,1,,,40.2774141,140.4991246,
765,E0520400083111,川口小学校,秋田県大館市川口字隼人岱108-68,1,,,40.27784886,140.4966196,
766,E0520400084111,下川沿中学校,秋田県大館市川口字隼人岱108-69,1,,,40.2784357,140.4978566,
767,E0520400085121,母子生活支援施設　白百合ホーム,秋田県大館市泉町7-20,,,要配慮者,40.2639406611822,140.558466207469,
768,E0520400086121,大館乳児保育園,秋田県大館市泉町8-12,,,要配慮者,40.2639510838689,140.557546390379,
769,E0520400087111,田代体育館（グリアス）,秋田県大館市早口字岩瀬越6-1,1,,,40.29061591,140.4484974,
770,E0520400088111,田代公民館岩野目分館,秋田県大館市早口字岩野目22,1,,,40.3105972,140.40464,
771,E0520400089111,田代公民館本郷分館,秋田県大館市早口字上屋敷66-2,1,,,40.28825294,140.4280315,
772,E0520400090111,田代公民館,秋田県大館市早口字上野43-1,1,,,40.27006549,140.4460608,
773,E0520400091111,田代公民館早口一分館,秋田県大館市早口字上野55-8,1,,,40.27215343,140.4468214,
774,E0520400092111,田代公民館谷地の平分館,秋田県大館市早口字深沢岱40-4,1,,,40.27988431,140.4516809,
775,E0520400093111,旧岩野目小学校,秋田県大館市早口字前田73-1,1,,,40.30992456,140.4061028,
776,E0520400094111,田代公民館大野分館,秋田県大館市早口字大野1-4,1,,,40.3479883,140.3886764,
777,E0520400095111,田代老人福祉センター,秋田県大館市早口字堤ノ沢4,1,,,40.27675776,140.4465574,
778,E0520400096111,田代公民館大野分館体育館,秋田県大館市早口字墓所岱65-3,1,,,40.34780023,140.3879709,
779,E0520400098111,上川沿公民館,秋田県大館市池内字大出135,1,,,40.24334557,140.5731068,
780,E0520400102111,はやぐち児童館,秋田県大館市長坂字坂地13-1,1,,,40.2715630370373,140.436860905301,
781,E0520400103111,早口小学校,秋田県大館市長坂字坂地岱12,1,,,40.27128546,140.4329048,
782,E0520400104111,田代公民館早口二分館,秋田県大館市長坂字宝田岱33-5,1,,,40.26998428,140.4322517,
783,E0520400105111,大館少年自然の家,秋田県大館市東字岩神沢31,1,,,40.27347008,140.5911092,
784,E0520400106121,障害者支援施設　道目木更生園,秋田県大館市道目木字陣場岱38,,,要配慮者,40.2062006114655,140.622739893523,
785,E0520400107111,二井田公民館,秋田県大館市二井田字高村1,1,,,40.23796485,140.5516029,
786,E0520400108111,南中学校,秋田県大館市二井田字小石台20,1,,,40.24766691,140.5230346,
787,E0520400110111,二井田保育所,秋田県大館市二井田字贄ノ里190,1,,,40.23785807,140.5519763,
788,E0520400111111,矢立保育所,秋田県大館市白沢字白沢1139-4,1,,,40.34356968,140.5865216,
789,E0520400112111,矢立小学校,秋田県大館市白沢字白沢1149,1,,,40.34306908,140.5869371,
790,E0520400112112,矢立公民館,秋田県大館市白沢字白沢1149,1,,,40.34281967,140.5874333,
791,E0520400113121,障害者支援施設　矢立育成園,秋田県大館市白沢字白沢851,,,要配慮者,40.3364201744882,140.581896828723,
792,E0520400114111,粕田沢農林業多目的研修集会施設,秋田県大館市粕田字中羽立156,1,,,40.34451371,140.5807619,
793,E0520400115111,二井田公民館麓西分館,秋田県大館市比内前田字下前田8,1,,,40.23071756,140.5098864,
794,E0520400116111,西館児童館,秋田県大館市比内町笹館字前田野73,1,,,40.2093255,140.5643717,
795,E0520400117111,西館小学校,秋田県大館市比内町笹館字前田野77,1,,,40.21123998,140.5636926,
796,E0520400118111,西館保育園,秋田県大館市比内町笹館字前田野79-1,1,,,40.21195368,140.5623352,
797,E0520400119121,比内福祉保健総合センター（ハートヒルとっと）,秋田県大館市比内町新館字館下79-1,,,要配慮者,40.21752849,140.5827034,
798,E0520400120121,特別養護老人ホーム　はなみずき,秋田県大館市比内町新館字真館21-2,,,要配慮者,40.2151783972742,140.586731185583,
799,E0520400121121,特別養護老人ホームやまぼうし,秋田県大館市比内町新館字真館21-6,,,要配慮者,40.2159277528714,140.586706878196,
800,E0520400122111,比内児童館,秋田県大館市比内町扇田字伊勢堂岱178,1,,,40.22548758,140.5844528,
801,E0520400125111,比内体育館,秋田県大館市比内町扇田字庚申岱34-2,1,,,40.2244672,140.5838657,
802,E0520400127111,比内公民館,秋田県大館市比内町扇田字庚申岱8,1,,,40.22402894,140.5835224,
803,E0520400128111,比内中学校,秋田県大館市比内町扇田字新館野中岱12,1,,,40.21217634,140.5890848,
804,E0520400129111,扇田保育園,秋田県大館市比内町扇田字町後13-8,1,,,40.226206,140.5831445,
805,E0520400131111,扇田小学校,秋田県大館市比内町扇田字白砂131,1,,,40.22619143,140.5795994,
806,E0520400132111,旧大葛小学校体育館,秋田県大館市比内町大葛字休間内沢口22,1,,,40.13498413,140.6584612,
807,E0520400133111,高齢者・若者センター（比内公民館大葛分館）※土砂災害時不可,秋田県大館市比内町大葛字大葛家後74-3,1,,,40.12992088,140.667456,
