808,E0520400134111,構造改善センター（比内公民館西館分館）,秋田県大館市比内町達子字曲谷地62-7,1,,,40.21176081,140.5650455,
809,E0520400135111,比内支援学校,秋田県大館市比内町達子字前田野1-2,1,,,40.21666893,140.5641184,
810,E0520400138111,比内公民館三岳分館,秋田県大館市比内町中野字上客路橋7-17,1,,,40.1781332,140.5941712,
811,E0520400139111,比内公民館東館分館,秋田県大館市比内町独鈷字小館下18-2,1,,,40.1924541,140.6042081,
812,E0520400141111,東館保育園,秋田県大館市比内町独鈷字独鈷11,1,,,40.19257726,140.6036668,
813,E0520400142111,東館小学校,秋田県大館市比内町独鈷字独鈷90,1,,,40.19213193,140.6005127,
814,E0520400143111,小泉交流センター,秋田県大館市比内町白沢水沢字水沢25-2,1,,,40.18875165,140.5137521,
815,E0520400144111,比内公民館八木橋分館,秋田県大館市比内町八木橋字畠沢岱16,1,,,40.20660024,140.5351585,
816,E0520400145111,比内公民館味噌内分館※土砂災害時不可,秋田県大館市比内町味噌内字鬼ケ沢10,,,,40.20247916,140.6089488,
817,E0520400148111,大館鳳鳴高等学校定時制桜楯館,秋田県大館市柄沢字狐台52-2,1,,,40.25853763,140.5724495,
818,E0520400149111,大館桂桜高等学校,秋田県大館市片山町3-10-43,1,,,40.27565146,140.5297441,
819,E0520400151111,大館労働福祉会館,秋田県大館市豊町2-37,1,,,40.27428915,140.5564258,
820,E0520400152111,第一中学校,秋田県大館市北神明町10-1,1,,,40.26778733,140.5485922,
821,E0520400155111,有浦保育園,秋田県大館市有浦1-7-38,1,,,40.28379511,140.5664649,
822,E0520400156111,北地区コミュニティセンター本館,秋田県大館市有浦1-8-15,1,,,40.28520552,140.5658044,
823,E0520400157111,有浦児童会館分館,秋田県大館市有浦1-8-33,1,,,40.2847493,140.5659177,
824,E0520400158111,有浦児童会館,秋田県大館市有浦4-6-43,1,,,40.28360871,140.5689172,
825,E0520400159111,有浦小学校,秋田県大館市有浦4-6-55,1,,,40.28444837,140.5679125,
826,E0520400160111,東中学校,秋田県大館市有浦5-2-8,1,,,40.28282809,140.5695229,
827,E0521200002111,中仙公民館鴬野分館,秋田県大仙市下鴬野字上村1,1,,,39.5705464915254,140.560796909776,
828,E0521200003111,協和公民館淀川分館,秋田県大仙市下淀川字車田16-1,,,,39.553091731109,140.25833197067,（住所：秋田県大仙市協和下淀川字車田16-1）
829,E0521200004111,花館公民館,秋田県大仙市花館上町5-19,,,,39.472371204286,140.46534604346,
830,E0521200005111,花館小学校,秋田県大仙市花館中町1-40,,,,39.472988204851,140.46467012679,
831,E0521200006121,特別養護老人ホーム　花館,秋田県大仙市花館柳町1-51,,,要配慮者,39.4742024254537,140.460103212875,
832,E0521200007121,特別養護老人ホーム　サン・サルビア,秋田県大仙市角間川町字元道巻97,,,要配慮者,39.3985475088186,140.480026548144,
833,E0521200008111,角間川公民館,秋田県大仙市角間川町字四上町1,,,,39.40196456891,140.48376199754,
834,E0521200010111,角間川小学校,秋田県大仙市角間川町字大浦町99,1,,,39.404026758464,140.48466220565,
835,E0521200011121,かわ舟の里角間川,秋田県大仙市角間川町字町頭98,,,要配慮者,39.4003050009539,140.480218029652,
836,E0521200013111,大綱交流館,秋田県大仙市刈和野字愛宕下24-1,1,,,39.544555237069,140.3758368134,
837,E0521200015121,特別養護老人ホーム　ウォームハート,秋田県大仙市刈和野字愛宕町17-1,,,要配慮者,39.544093890574,140.370200617789,
838,E0521200017111,西仙北ぬく森温泉ユメリア,秋田県大仙市刈和野字山北ノ沢5-4,,,,39.563807913354,140.3756386439,
839,E0521200018111,西仙北スポーツセンター,秋田県大仙市刈和野字小野17-1,1,,,39.550270669793,140.37280531691,
840,E0521200019111,西仙北小学校,秋田県大仙市刈和野字上ノ台322,1,,,39.550941184676,140.37918739904,
841,E0521200020111,西仙北中学校,秋田県大仙市刈和野字田中蟻塚12,1,,,39.549554370562,140.38927368709,
842,E0521200021111,西仙北高等学校,秋田県大仙市刈和野字北ノ沢嶋山5-1,1,,,39.556991463581,140.37625773263,
843,E0521200194111,稲沢体育館,秋田県大仙市協和稲沢字堤ヶ沢出口6,1,,,39.614815094345,140.4366893212,
844,E0521200024111,協和小学校,秋田県大仙市協和境字岸舘37,1,,,39.609771503522,140.32860316458,
845,E0521200025111,協和中学校,秋田県大仙市協和境字岸舘90,,,,39.610672441936,140.33049143972,
846,E0521200028111,道の駅協和,秋田県大仙市協和荒川字新田表15-2,1,,,39.618878729976,140.362241815519,
847,E0521200031111,小種体育館,秋田県大仙市協和小種字上鏡台2-1,,,,39.527765300793,140.26759515996,
848,E0521200189111,小種世代交流福祉館,秋田県大仙市協和小種字上鏡台2-7,,,,39.526976,140.266544,
849,E0521200033121,介護老人保健施設　サングレイス,秋田県大仙市協和上淀川字五百刈田278-5,,,要配慮者,39.5984830269193,140.303679017275,
850,E0521200034111,船岡共学館,秋田県大仙市協和船岡字下中野159-2,1,,,39.646283177457,140.32701850644,
851,E0521200036111,宇津野自治会館,秋田県大仙市協和船岡字上宇津野282-2,,,,39.660215247712,140.34971712074,
852,E0521200037111,美山荘（協和スキー場）,秋田県大仙市協和船岡字上庄内71-1,1,,,39.68091216499,140.39318051149,
853,E0521200039111,協和市民センター「和ピア」,秋田県大仙市協和船岡字大袋1-7,1,,,39.62176475969,140.31515953979,
854,E0521200040121,特別養護老人ホーム　峰山荘,秋田県大仙市協和中淀川字中村12-2,1,,要配慮者,39.5744274258331,140.258444548189,
855,E0521200041111,中淀川世代交流福祉館,秋田県大仙市協和中淀川字鳥屋野22,,,,39.581252288607,140.27887134809,
856,E0521200043111,旧峰吉川小学校体育館（協和第２体育館）,秋田県大仙市協和峰吉川字南明谷地1-1,,,,39.566062168664,140.33166416522,
857,E0521200045111,半仙会館,秋田県大仙市協和峰吉川字半仙64-320,,,,39.566468363222,140.32469318341,
858,E0521200046111,強首地区多目的研修施設,秋田県大仙市強首字上野台1,1,,,39.548613455383,140.30095488414,
859,E0521200048121,介護老人保健施設　幸寿園,秋田県大仙市強首字上野台12-15,,,要配慮者,39.5437806011901,140.29999372451,
860,E0521200049121,障がい者支援施設　柏の郷,秋田県大仙市強首字上野台23-18,,,要配慮者,39.533718551522,140.318219648556,
861,E0521200049122,特別養護老人ホーム　ありすの街,秋田県大仙市強首字上野台23-18,,,要配慮者,39.5344708060009,140.317725975789,
862,E0521200051111,西仙北西体育館,秋田県大仙市強首字上野台92-1,1,,,39.531183103279,140.3060665931,
863,E0521200052121,ショートステイ大仙　あんり,秋田県大仙市戸地谷字大和田288-1,,,要配慮者,39.4702070040257,140.494862323553,
864,E0521200053111,はぴねす大仙,秋田県大仙市幸町2-70,,,,39.470817504875,140.48044484839,
865,E0521200054111,高梨小学校,秋田県大仙市高梨字新屋敷1,1,,,39.456266171931,140.5224669755,
866,E0521200055111,さくまろ館,秋田県大仙市高梨字田茂木10,,,,39.4617482157819,140.507011932874,
867,E0521200057111,四ツ屋小学校,秋田県大仙市四ツ屋字下古道81,1,,,39.493860680247,140.50001658832,
868,E0521200058112,ふれあいの郷まつくら（交流室）,秋田県大仙市四ツ屋字小又35-1,1,,,39.514032,140.478213,
869,E0521200059111,四ツ屋公民館,秋田県大仙市四ツ屋字西下瀬162-4,,,,39.492208927338,140.5005476657,
870,E0521200060111,大曲中学校,秋田県大仙市若竹町7-17,1,,,39.467304771792,140.46720426855,
871,E0521200062111,神岡農村環境改善センター,秋田県大仙市神宮寺字下川原前開100,,,,39.496057082303,140.41434323174,
872,E0521200063111,かみおか嶽雄館,秋田県大仙市神宮寺字下川原前開102,1,,,39.496383343792,140.41370032728,
873,E0521200066111,平和中学校,秋田県大仙市神宮寺字荒屋20,,,,39.49844557943,140.41932824893,
874,E0521200068111,神岡小学校,秋田県大仙市神宮寺字神宮寺52,,,,39.490851112085,140.42833991976,
875,E0521200069111,神岡体育館,秋田県大仙市神宮寺字大坪街道下22,,,,39.496959523941,140.41428647781,
876,E0521200074121,特別養護老人ホーム　愛幸園,秋田県大仙市神宮寺字本郷道南78,,,要配慮者,39.4912399158772,140.417616177799,
877,E0521200201111,神岡市民センター,秋田県大仙市神宮寺字蓮沼16-3,,,,39.492169,140.425588,大仙市役所神岡支所内
878,E0521200076111,中仙公民館清水分館,秋田県大仙市清水字上大蔵75-1,,,,39.5188588255758,140.551414687116,
879,E0521200077111,清水小学校,秋田県大仙市清水字上大蔵86,1,,,39.517997995994,140.55427658733,
880,E0521200079111,太田南小学校,秋田県大仙市太田町横沢字窪関南298,1,,,39.508853915001,140.59626041419,
881,E0521200080111,おおたコミュニティプラザ,秋田県大仙市太田町横沢字窪関南501,,,,39.5106294799109,140.597187349555,
882,E0521200081121,特別養護老人ホーム　真木苑,秋田県大仙市太田町横沢字窪関南535-1,,,要配慮者,39.5098774085554,140.598704808275,
883,E0521200083111,太田体育館,秋田県大仙市太田町横沢字堤田369-1,,,,39.505537840334,140.60733823416,
884,E0521200084111,太田体育館クラブハウス,秋田県大仙市太田町横沢字堤田369-4,,,,39.505831707789,140.60753135321,
885,E0521200085111,太田北小学校,秋田県大仙市太田町国見字国見田115,1,,,39.52936878932,140.58353548352,
886,E0521200086111,太田北部地区多目的研修センター,秋田県大仙市太田町国見字佐弊神161,,,,39.527972588627,140.58749366065,
887,E0521200087111,太田東小学校,秋田県大仙市太田町斉内字高野1-93,1,,,39.52644527799,140.62863723249,
888,E0521200089111,太田文化プラザ,秋田県大仙市太田町太田字新田田尻3-4,,,,39.51430022037,140.59713333529,
889,E0521200090111,太田中学校,秋田県大仙市太田町太田字新田田尻76,1,,,39.514633008878,140.59963053366,
890,E0521200092111,太田東部地区生活改善センター,秋田県大仙市太田町太田字築地古館27-1,,,,39.521097635364,140.63072074993,
891,E0521200092112,太田トレーニングセンター,秋田県大仙市太田町太田字築地古館27-1,,,,39.520641330848,140.63116146212,
892,E0521200093111,敬愛館,秋田県大仙市太田町東今泉字大信田472-10,,,,39.517065931411,140.63224507456,
893,E0521200097111,大曲高等学校,秋田県大仙市大曲栄町6-7,,,,39.453387124302,140.47952691444,
894,E0521200098111,大曲小学校,秋田県大仙市大曲花園町4-88,1,,,39.454593125691,140.47434674106,
895,E0521200101111,大曲農業高等学校,秋田県大仙市大曲金谷町26-9,1,,,39.449285563085,140.47303084909,
896,E0521200105111,東大曲小学校,秋田県大仙市大曲字下高畑81,1,,,39.448079029591,140.49426634571,
897,E0521200106111,大曲工業高等学校,秋田県大仙市大曲若葉町3-17,1,,,39.452559124935,140.48856488899,
898,E0521200108121,グループホーム　銀のさじ,秋田県大仙市大曲上栄町11-2,,,要配慮者,39.4510460370546,140.477526186419,
899,E0521200111111,大川西根公民館,秋田県大仙市大曲西根字小館10,,,,39.448071904291,140.45190105337,
900,E0521200112111,大川西根小学校,秋田県大仙市大曲西根字小館20,1,,,39.447910350205,140.4527700891,
901,E0521200113111,道路維持センター,秋田県大仙市大曲西根字上野150-2,,,,39.459006832095,140.45143188916,
902,E0521200115121,介護老人保健施設　なごみのさと,秋田県大仙市大曲船場町1-1-4,,,要配慮者,39.4578491694616,140.471458767729,
903,E0521200116111,ペアーレ大仙,秋田県大仙市大曲中通町10-6,,,,39.463010095939,140.47934020932,
904,E0521200118111,大曲地域職業訓練センター,秋田県大仙市大曲田町3-1,,,,39.451547399645,140.48113416605,
905,E0521200121111,サンクエスト大曲,秋田県大仙市大曲日の出町1-23-3,,,,39.446266846603,140.47719997343,
906,E0521200125111,大曲市民会館,秋田県大仙市大曲日の出町2-6-50,,,,39.447969160159,140.48123761368,
907,E0521200126111,大曲中央公民館,秋田県大仙市大曲日の出町2-6-60,,,,39.448913624092,140.48123761368,
908,E0521200127111,大曲交流センター,秋田県大仙市大曲日の出町2-7-53,,,,39.448388802188,140.48190936134,
909,E0521200131111,西仙北林業者等健康増進施設,秋田県大仙市大沢郷宿字横山59-2,1,,,39.5231118768,140.30920535907,
910,E0521200133111,道の駅なかせんこめこめプラザ,秋田県大仙市長野字高畑95-1,1,,,39.538427381471,140.53307501868,
911,E0521200134111,中仙中学校,秋田県大仙市長野字新山5-1,1,,,39.540496238396,140.53960744538,
912,E0521200135111,中仙農村環境改善センター,秋田県大仙市長野字茶畑108,,,,39.545034669543,140.54440906088,
913,E0521200136111,八乙女交流センター,秋田県大仙市長野字長野山88,,,,39.536372998007,140.51971437297,
914,E0521200137111,中仙小学校,秋田県大仙市長野字六日町215,,,,39.543074952553,140.53222838311,
915,E0521200138111,西仙北農村環境改善センター,秋田県大仙市土川字刈布沢24-48,1,,,39.548820288617,140.40261847424,
916,E0521200141111,小杉山地区生涯学習センター,秋田県大仙市土川字小杉山沢ノ内焼山1-2,1,,,39.545971919392,140.45194982109,
917,E0521200143111,西今泉公民館,秋田県大仙市土川字大楽182,,,,39.559871896784,140.40793548322,
918,E0521200146111,藤木公民館,秋田県大仙市藤木字乙本藤木8,,,,39.412519113562,140.49485532741,
919,E0521200147111,藤木小学校,秋田県大仙市藤木字街道下67,1,,,39.412397372183,140.49368203712,
920,E0521200148111,大曲南中学校,秋田県大仙市藤木字上野中70-2,1,,,39.410795867144,140.48797471523,
921,E0521200150111,内小友小学校,秋田県大仙市内小友字四ツ村35,1,,,39.418522193074,140.451537281,
922,E0521200151111,内小友公民館,秋田県大仙市内小友字仙北屋68-2,,,,39.419118950274,140.45166602704,
923,E0521200152111,大曲西中学校,秋田県大仙市内小友字中沢176-1,1,,,39.437856530472,140.44169363575,
924,E0521200154121,特別養護老人ホーム　テンダーヒルズ,秋田県大仙市内小友字明通36-2,,,要配慮者,39.4318543458156,140.438309058656,
925,E0521200155111,南外コミュニティセンター,秋田県大仙市南外字下袋218,,,,39.449122111066,140.36486515084,
926,E0521200156111,旧南外西小学校,秋田県大仙市南外字下湯ノ又198-14,1,,,39.437032389388,140.35626084071,
927,E0521200159111,南外中学校,秋田県大仙市南外字赤平台野19-1,1,,,39.46074249955,140.37110675593,
928,E0521200161121,特別養護老人ホーム福寿園,秋田県大仙市南外字湯神台10,,,要配慮者,39.4284187898778,140.359990468229,
929,E0521200162112,南楢岡コミュニティセンター,秋田県大仙市南外字坊田240,,,,39.47667,140.384701,
930,E0521200163111,南外体育館,秋田県大仙市南外字梨木田208-3,,,,39.462081761254,140.37425188079,
931,E0521200191111,柵の湯,秋田県大仙市板見内字一ツ森149,1,,,39.472933,140.536168,
932,E0521200164121,特別養護老人ホーム　真森苑,秋田県大仙市板見内字一ツ森410,,,要配慮者,39.4734091649041,140.534106305805,
933,E0521200166121,特別養護老人ホーム　こもれびの杜,秋田県大仙市飯田字堰東235,,,要配慮者,39.440347578693,140.48535007351,
934,E0521200168121,ショートステイ大曲,秋田県大仙市飯田字大槻127-1,,,要配慮者,39.447029397855,140.488850008609,
935,E0521200169111,横堀小学校,秋田県大仙市福田字穴沢4,1,,,39.48748757815,140.53769040172,
936,E0521200171111,中仙公民館豊岡分館,秋田県大仙市豊岡字中荒井野175,,,,39.559408382729,140.60878774475,
937,E0521200173111,豊成小学校,秋田県大仙市豊川字下水無47,1,,,39.55788665149,140.58672869233,
938,E0521200174111,中仙公民館豊川分館,秋田県大仙市豊川字久保175,,,,39.554776913129,140.58247331871,
939,E0521200176121,介護老人保健施設　八乙女荘,秋田県大仙市北長野字野口前23,,,要配慮者,39.5490939734725,140.54729304478,
940,E0521200177121,特別養護老人ホーム　桜寿苑,秋田県大仙市北長野字野口前47,,,要配慮者,39.5485319231386,140.5471749703,
941,E0521200181111,音楽交流館（旧北神小学校）,秋田県大仙市北楢岡字嶋151,1,,,39.505874898469,140.38816337255,
942,E0521200182111,北楢岡公民館,秋田県大仙市北楢岡字北楢岡57,,,,39.499767637033,140.39993771722,
943,E0521200183111,西仙北農村交流施設,秋田県大仙市北野目字堂伝野2,1,,,39.544565660656,140.34636488176,
944,E0521200184111,ふれあい体育館,秋田県大仙市堀見内字下田茂木122,,,,39.466860607213,140.50894604159,
945,E0521200186111,仙北ふれあい文化センター,秋田県大仙市堀見内字元田茂木7-1,,,,39.466222845675,140.50892458391,
946,E0521200187111,仙北中学校,秋田県大仙市堀見内字西福嶋29,1,,,39.471505299943,140.51840762808,
947,E0521200188111,中仙公民館鑓見内分館,秋田県大仙市鑓見内字石持108,1,,,39.518659173357,140.51831912738,
948,E0520600002111,美里小学校,秋田県男鹿市鵜木字松木沢境90,1,,,39.979686999606,139.921897350083,
949,E0520600003111,若美総合体育館,秋田県男鹿市鵜木字中角境36,1,,,39.968927,139.90847,
950,E0520600006121,特別養護老人ホーム　和幸苑,秋田県男鹿市角間崎字岡見沢86-12,,,要配慮者,39.9602499213145,139.904898988642,
951,E0520600025111,五里合コミュニティセンター,秋田県男鹿市五里合神谷字下石27,1,,,39.982188,139.869926,
952,E0520600034121,介護老人保健施設　たらちね,秋田県男鹿市船越字一向67-1,,,要配慮者,39.897984341579,139.948732000581,
953,E0520600035111,男鹿東中学校,秋田県男鹿市船越字根木169,1,,,39.9131243112853,139.923112537972,
954,E0520600039111,男鹿工業高等学校,秋田県男鹿市船越字内子1-1,1,,,39.9040432303501,139.934421261251,
955,E0520600041121,特別養護老人ホーム　ゆりの希,秋田県男鹿市船越字内子294-3,,,要配慮者,39.9069400211583,139.922611556889,
956,E0520600044111,船越小学校,秋田県男鹿市船越字本町7,1,,,39.9029741914534,139.944600371306,
957,E0520600050111,サンワーク男鹿,秋田県男鹿市船川港金川字姫ケ沢158-10,1,,,39.8911309567001,139.850499956883,
958,E0520600052121,樹園　養護老人ホーム,秋田県男鹿市船川港女川字鵜ノ崎130-1,,,要配慮者,39.8615766280639,139.818942538618,
959,E0520600070111,船川第一小学校,秋田県男鹿市船川港船川字漆畑36-1,1,,,39.8919077323626,139.847170388473,
960,E0520600088121,ユニット型特別養護老人ホーム南海の丘,秋田県男鹿市船川港台島字中台108,,,要配慮者,39.8650642944911,139.80797698173,
961,E0520600097111,旧船川南小学校体育館,秋田県男鹿市船川港南平沢字越名坂1,1,,,39.878130182239,139.838169729685,
962,E0520600098111,男鹿南中学校,秋田県男鹿市船川港南平沢字上大畑台30,1,,,39.8746500311465,139.838710287126,
963,E0520600099111,男鹿海洋高等学校,秋田県男鹿市船川港南平沢字大畑台42,1,,,39.87674475,139.8389025,
964,E0520600101121,特別養護老人ホーム　寿恵園,秋田県男鹿市船川港比詰字神明堂脇7,1,,要配慮者,39.9093747555515,139.857881387018,
965,E0520600104111,船川北公民館,秋田県男鹿市船川港比詰字大沢田44-4,,,,39.9154529110777,139.852062494977,
966,E0520600102111,男鹿市総合体育館,秋田県男鹿市船川港比詰字大沢田１１１外,1,,,39.911257,139.853773,
967,E0520600117111,旧潟西中学校,秋田県男鹿市福米沢字八卦1-1,1,,,39.9981046967611,139.929436488692,
968,E0520600122111,若美ふれあい創明館,秋田県男鹿市払戸字川向8-1,1,,,39.92241239,139.9385928,
969,E0520600124111,払戸小学校,秋田県男鹿市払戸字渡部97,1,,,39.9372479875039,139.925353779548,
970,E0520600128111,温泉会館五風,秋田県男鹿市北浦湯本字草木原21-2,1,,,39.97343872,139.742365,
971,E0520600134111,旧男鹿北中学校,秋田県男鹿市北浦北浦字山王林40,1,,,39.9684480927014,139.77584660188,
972,E0520600140111,北陽小学校,秋田県男鹿市北浦北浦表町字表町19,1,,,39.9652430345939,139.777485002565,
973,E0520600162111,旧脇本第二小学校体育館,秋田県男鹿市脇本樽沢字刈沢156,1,,,39.9343882010915,139.903906117733,
974,E0520600164121,介護老人保健施設男鹿老健,秋田県男鹿市脇本富永字南前田72,,,要配慮者,39.915933,139.902078,
975,E0520600167111,脇本第一小学校,秋田県男鹿市脇本脇本字上野1-1,1,,,39.9081127692916,139.898547498701,
976,E0520600169111,脇本コミュニティセンター,秋田県男鹿市脇本脇本字前野8,1,,,39.9121649651693,139.90878736586,
977,E0546400002111,岩井川防災センター,秋田県東成瀬村岩井川字村中94-2,,,,39.176726585007,140.697757194,
978,E0546400003111,地域交流センターゆるるん,秋田県東成瀬村岩井川字東村72,,,,39.176605908985,140.70066841416,
979,E0546400004111,青少年山の家,秋田県東成瀬村岩井川字野頭36-2,,,,39.1792347117,140.728580023,
980,E0546400006111,谷地天江会館,秋田県東成瀬村椿川字ブナノ木沢53,,,,39.1037905944,140.721743323,
981,E0546400007111,間木重里台会館,秋田県東成瀬村椿川字間木8,,,,39.135550477088,140.71754373827,
982,E0546400008111,五里台センター,秋田県東成瀬村椿川字五里台53-6,,,,39.126512338982,140.71829129823,
983,E0546400009111,地域交流センター大柳センター,秋田県東成瀬村椿川字大柳下村54,,,,39.094782410912,140.72053070126,
984,E0546400010111,地域交流センター成瀬川交流館,秋田県東成瀬村椿川字大柳下村56-1,,,,39.095806614751,140.72085255748,
985,E0546400011111,手倉会館,秋田県東成瀬村椿川字中村120-1,1,,,39.158910242108,140.71231441382,
986,E0546400012111,地域交流センターまるごと自然館,秋田県東成瀬村椿川字堤31-2,,,,39.146652246343,140.71549796466,
987,E0546400013111,下田センター,秋田県東成瀬村田子内字下田160-2,,,,39.183364862235,140.637633228,
988,E0546400015111,肴沢センター,秋田県東成瀬村田子内字肴沢105-1,,,,39.172027,140.678124,
989,E0546400016111,滝ノ沢センター,秋田県東成瀬村田子内字若宮3-1,,,,39.1881764214,140.629822573,
990,E0546400017111,東成瀬村民体育館,秋田県東成瀬村田子内字上野21-3,,,,39.180085700887,140.6508042285,
991,E0546400018111,東成瀬小学校,秋田県東成瀬村田子内字上野8,,,,39.180082,140.650161,
992,E0546400019111,なるせっ子夢センター,秋田県東成瀬村田子内字上野8-1,,,,39.18009727773,140.64935272535,
993,E0546400021111,東成瀬中学校,秋田県東成瀬村田子内字上林18,,,,39.17786,140.654883,
994,E0546400023121,東成瀬村保健センター,秋田県東成瀬村田子内字仙人下11-3,,,要配慮者,39.178995789121,140.64784121997,
995,E0546400024112,山村開発センター,秋田県東成瀬村田子内字仙人下30-1,,,,39.179112194795,140.64893020609,
996,E0546400024111,防災情報センター,秋田県東成瀬村田子内字仙人下30-1,,,,39.179286845779,140.64959002951,
997,E0546400025111,農村交流センター,秋田県東成瀬村田子内字田子内40,,,,39.180448,140.645151,
998,E0546400026121,特別養護老人ホーム幸寿苑,秋田県東成瀬村田子内字二階野206,,,要配慮者,39.180716907108,140.65688409669,
999,E0546400028111,平良センター,秋田県東成瀬村田子内字二階野88-1,,,,39.180715770587,140.65807600998,
1000,E0546400029111,蛭川会館,秋田県東成瀬村田子内字蛭川2-4,,,,39.176860549044,140.66142485353,
1001,E0520700001111,旧稲庭小学校体育館,秋田県湯沢市稲庭町字琵琶倉24,1,,,39.104902791986,140.58494665213,
1002,E0520700002111,横堀交流センター体育館,秋田県湯沢市横堀字小田中5-2,1,,,39.061382773184,140.45170318075,
1003,E0520700003113,市立雄勝小学校体育館,秋田県湯沢市横堀字板橋5,1,,,39.055150105778,140.45054265542,
1004,E0520700003111,雄心館,秋田県湯沢市横堀字板橋5,1,,,39.055545323977,140.44938796493,
1005,E0520700003112,市立雄勝中学校体育館,秋田県湯沢市横堀字板橋5,1,,,39.054637724743,140.449164,
1006,E0520700004111,旧院内小学校体育館,秋田県湯沢市下院内字笈形町73-1,1,,,39.052417639902,140.41986647141,
1007,E0520700005111,市立皆瀬中学校体育館,秋田県湯沢市皆瀬字下菅生24-1,1,,,39.078078106076,140.59037610374,
1008,E0520700006111,市立皆瀬小学校体育館,秋田県湯沢市皆瀬字下菅生27,1,,,39.077558514731,140.59034723171,
1009,E0520700055111,皆瀬体育館,秋田県湯沢市皆瀬字沢梨台107-1,1,,,39.075552,140.586147,
1010,E0520700013111,旧三関小学校体育館,秋田県湯沢市関口字堀量68,1,,,39.13308373253,140.48590384339,
1011,E0520700015111,ふるさとふれあいセンター,秋田県湯沢市岩崎字寝連沢9-4,1,,,39.200427066581,140.5072711224,
