459,E1620900023111,津沢小学校（体育館）,富山県小矢部市新西222,1,,,36.626347,136.893176,
460,E1620900024113,水島保育所,富山県小矢部市水島109-1,1,,,36.641315,136.901423,
461,E1620900024111,水島スポーツセンター,富山県小矢部市水島109-1,1,,,36.641474,136.901053,
462,E1620900024112,水島公民館,富山県小矢部市水島109-1,1,,,36.640744,136.900852,
463,E1620900025111,大谷小学校（体育館）,富山県小矢部市水牧10,1,,,36.671517,136.898373,
464,E1620900026111,ＳＴ物流サービス㈱小矢部物流センター,富山県小矢部市水牧123,1,,,36.66783519,136.8950689,
465,E1620900028111,津沢コミュニティプラザ（津沢公民館含む）,富山県小矢部市清水369-1,1,,,36.625759,136.901611,
466,E1620900029111,となみ野高等学校,富山県小矢部市清水95-1,1,,,36.61897,136.901601,
467,E1620900030111,津沢中学校（体育館）,富山県小矢部市清沢1231,1,,,36.619196,136.89774,
468,E1620900068111,株式会社ゴールドウイン富山本店,富山県小矢部市清沢210,1,,,36.626687,136.896617,
469,E1620900031111,若林運動広場体育館,富山県小矢部市西中209,1,,,36.658479,136.908617,
470,E1620900032111,小矢部園芸高等学校,富山県小矢部市西中210,1,,,36.658793,136.908693,
471,E1620900033111,東部小学校（体育館）,富山県小矢部市西中野320,1,,,36.685676,136.87631,
472,E1620900034111,石動高等学校（体育館）,富山県小矢部市西町6-33,1,,,36.674937,136.861998,
473,E1620900036111,埴生保育所,富山県小矢部市石坂1,1,,,36.659798,136.85146,
474,E1620900037111,埴生公民館,富山県小矢部市石坂65,1,,,36.658275,136.851322,
475,E1620900039111,松沢公民館,富山県小矢部市赤倉106,1,,,36.662554,136.880507,
476,E1620900040111,武道館,富山県小矢部市泉町2-30,1,,,36.672684,136.873372,
477,E1620900043111,㈱北陸ＬＩＸＩＬ製作所　小矢部工場,富山県小矢部市浅地130,1,,,36.63695752,136.8683465,
478,E1620900044113,薮波スポーツセンター,富山県小矢部市浅地672-1,1,,,36.63862,136.874262,
479,E1620900044111,薮波公民館,富山県小矢部市浅地672-1,1,,,36.638525,136.873862,
480,E1620900045111,サイクリングターミナル,富山県小矢部市浅地字浄土寺119-9,1,,,36.622534,136.873831,
481,E1620900049111,東蟹谷公民館,富山県小矢部市藤森5277-1,1,,,36.630372,136.85382,
482,E1620900050111,蟹谷中学校（体育館）,富山県小矢部市藤森60,1,,,36.622511,136.854848,
483,E1620900052111,大和トランスポート㈱　研修センター　あすなろ,富山県小矢部市道坪野869-2,1,,,36.68547904,136.8377308,
484,E1620900053111,正得公民館,富山県小矢部市道明119,1,,,36.680847,136.916865,
485,E1620900055111,石動きらりこども園,富山県小矢部市畠中町9-10,1,,,36.678997,136.875971,
486,E1620900056111,蟹谷こども園,富山県小矢部市平桜6055,1,,,36.636204,136.853406,
487,E1620900057111,蟹谷小学校（体育館）,富山県小矢部市平桜字岡山80,1,,,36.627243,136.847519,
488,E1620900058111,北蟹谷スポーツセンター,富山県小矢部市末友26,1,,,36.633387,136.833797,
489,E1620900059111,北蟹谷公民館,富山県小矢部市末友27,1,,,36.634074,136.834131,
490,E1620900060111,大谷こども園,富山県小矢部市野寺80,1,,,36.665553,136.892111,
491,E1620900061111,宮島公民館,富山県小矢部市了輪18,1,,,36.703425,136.850019,
492,E1620900062111,農村環境改善センター,富山県小矢部市鷲島38-1,1,,,36.659857,136.87796,
493,E1632200014112,山加積公民館,富山県上市町黒川112,,,,36.716959780697,137.39600693629,土砂災害警戒区域内施設
494,E1632200026121,上市老人保健福祉施設つるぎの庭,富山県上市町森尻704,,,高齢者等,36.718024499074,137.35498521981,
495,E1632200011111,上市町体育センター,富山県上市町稗田35-3,1,,,36.695560035666,137.35373003256,「洪水」は利用不適
496,E1634300002111,朝日町文化体育センター　サンリーナ,富山県朝日町越306,1,,,36.944274942048,137.56466661593,
497,E1634300061111,さみさと小学校,富山県朝日町沼保770,1,,,36.955835,137.562012,
498,E1634300078111,あさひ野小学校,富山県朝日町藤塚31,1,,,36.919146,137.559128,
499,E1620800001111,砺波市多世代交流施設しょうとう,富山県砺波市安川1616,,地震、土砂災害時避難可能施設,,36.62790923,137.0106877,
500,E1620800003111,栴檀山体育館,富山県砺波市井栗谷6552,1,地震、水害時避難可能施設,,36.59858558,137.0326121,
501,E1620800003112,栴檀山農村集落センター,富山県砺波市井栗谷6552,1,地震、水害時避難可能施設,,36.59831857,137.0325853,
502,E1620800005111,砺波市文化会館,富山県砺波市花園町1-32,1,「洪水時」２階以上に避難,,36.6407943,136.9606681,
503,E1620800005112,砺波市農村環境改善センター,富山県砺波市花園町1-32,1,「洪水時」２階以上に避難,,36.64123245,136.9606255,
504,E1620800006111,油田体育館,富山県砺波市宮丸466-4,1,,,36.65582255,136.9683035,
505,E1620800007111,せんだんのＨＩＬＬ,富山県砺波市宮森新159,1,,,36.647984,137.028122,
506,E1620800007112,栴檀野農村振興会館,富山県砺波市宮森新159,1,,,36.64776202,137.0282909,
507,E1620800008111,若林地区農業集落センター若林公民館,富山県砺波市狐島186,,,,36.65279455,136.9216624,
508,E1620800010111,若林体育館,富山県砺波市狐島208-1,,,,36.65317589,136.9221659,
509,E1620800011111,夢の平コスモス荘,富山県砺波市五谷160,,,,36.58745332,137.0213597,
510,E1620800013111,五鹿屋公民館,富山県砺波市五郎丸1119-1,,,,36.6091122,136.9650022,
511,E1620800014111,出町中学校武道館,富山県砺波市広上町8-16,,,,36.63394233,136.9479345,
512,E1620800015111,いこいの家たかなみ,富山県砺波市高波753,,,,36.67242627,136.9428604,
513,E1620800016111,高波農業集落センター,富山県砺波市高波839,1,,,36.6748098,136.9413948,
514,E1620800017111,高波体育館,富山県砺波市高波842-2,,,,36.6743866,136.9412629,
515,E1620800018111,麦秋苑,富山県砺波市三郎丸183-2,,,,36.65456203,136.9686317,
516,E1620800019111,あぶらでん認定こども園,富山県砺波市三郎丸213-1,,,,36.65139248,136.9721848,
517,E1620800020111,油田自治振興会館,富山県砺波市三郎丸96,,「洪水時」２階以上に避難,,36.65541585,136.9681708,
518,E1620800021111,南部認定こども園,富山県砺波市鹿島153,,,,36.61172554,136.9511199,
519,E1620800022111,砺波南部小学校,富山県砺波市鹿島161,1,,,36.61241887,136.9512556,
520,E1620800023111,東部保育所,富山県砺波市秋元144-1,,,,36.65170193,136.9946257,
521,E1620800024111,南般若公会堂,富山県砺波市秋元636,,「洪水時」２階以上に避難,,36.65370681,136.9857099,
522,E1620800025111,砺波市出町子供歌舞伎曳山会館,富山県砺波市出町中央5-4,,「洪水時」２階以上に避難,,36.64090002,136.9557891,
523,E1620800026111,林地区振興会館,富山県砺波市小島64,,,,36.65364,136.94332,
524,E1620800027111,庄川ふれあいプラザ,富山県砺波市庄川町金屋1092,,,,36.57304815,136.9956843,
525,E1620800028111,旧東山見児童館,富山県砺波市庄川町金屋1378,,,,36.57224367,136.9906208,
526,E1620800029111,庄川児童館,富山県砺波市庄川町金屋1743,1,,,36.57270633,136.990229,
527,E1620800030111,庄川小学校,富山県砺波市庄川町金屋1748,1,,,36.57289527,136.9898781,
528,E1620800031111,庄川高砂会館,富山県砺波市庄川町金屋岩黒35-1,,,,36.56470728,136.9858815,
529,E1620800032111,庄川親雪体育館,富山県砺波市庄川町五ケ435,,,,36.59416697,136.9759592,
530,E1620800033111,種田コミュニティセンター,富山県砺波市庄川町五ケ436-1,,,,36.59448097,136.9759954,
531,E1620800034111,たねだの舎,富山県砺波市庄川町五ケ436-2,1,,,36.59464,136.97625,
532,E1620800036111,となみ野農業協同組合稲種センター,富山県砺波市庄川町五ケ445-2,,,,36.5949023706563,136.974737092,
533,E1620800091111,東部地区防災センター（庄川コミュニティ消防センター）,富山県砺波市庄川町小牧,,,,36.562354,137.003132,
534,E1620800038111,雄神体育館,富山県砺波市庄川町庄3600-1,,,,36.60259602,137.0007139,
535,E1620800040111,雄神集会センター,富山県砺波市庄川町庄393,,,,36.60412156,137.0012181,
536,E1620800041111,旧雄神保育所,富山県砺波市庄川町庄400,1,,,36.60304594,137.0007874,
537,E1620800043112,青島地区交流館,富山県砺波市庄川町青島3374-2,1,,,36.5806704,136.9861497,
538,E1620800044111,庄川生涯学習センター,富山県砺波市庄川町青島3607,,「洪水時」２階以上に避難,,36.57764462,136.9889882,
539,E1620800045111,庄川体育センター,富山県砺波市庄川町青島3936,,,,36.58047534,136.9891035,
540,E1620800046111,庄川中学校,富山県砺波市庄川町青島3938,1,,,36.58107929,136.9884457,
541,E1620800047111,庄川健康プラザ,富山県砺波市庄川町青島401,1,,,36.5770035047199,136.985827462394,
542,E1620800049111,出町小学校,富山県砺波市深江1-238,1,,,36.63198918,136.9493235,
543,E1620800051111,砺波東部小学校,富山県砺波市千保250,1,「洪水時」２階以上に避難,,36.65009596,136.9789077,
544,E1620800052111,太田認定こども園,富山県砺波市太田1439,,,,36.62876148,136.9893726,
545,E1620800054111,太田公会堂,富山県砺波市太田1568,,,,36.62950157,136.989227,
546,E1620800055111,太田体育館,富山県砺波市太田983,,,,36.62863364,136.9886963,
547,E1620800056111,ちゅうりっぷ認定こども園,富山県砺波市太郎丸2-29-2,,「洪水時」２階以上に避難,,36.63161559,136.9610879,
548,E1620800057111,となみ散居村ミュージアム,富山県砺波市太郎丸80,,,,36.62598463,136.9638888,
549,E1620800058111,鷹栖公民館,富山県砺波市鷹栖1051,,,,36.62871481,136.9253446,
550,E1620800059111,（株）スリーティ運輸ヘルスケァ事業部（２階研修室）,富山県砺波市鷹栖1907,,「洪水時」２階以上に避難,,36.623421885482,136.91728306879,
551,E1620800060111,砺波工業高校（体育館）,富山県砺波市鷹栖285-1,,「洪水時」２階以上に避難,,36.6307806,136.9320486,
552,E1620800061111,鷹栖小学校,富山県砺波市鷹栖490,1,,,36.62694382,136.9275597,
553,E1620800062111,砺波工業（株）,富山県砺波市中央町1-8,,「洪水時」２階以上に避難,,36.639275,136.954499,
554,E1620800064111,庄南小学校,富山県砺波市中野1216,1,「洪水時」２階以上に避難,,36.61607557,136.9844738,
555,E1620800065111,中野振興会館,富山県砺波市中野239,,,,36.60727846,136.9859881,
556,E1620800066111,タワーパートナーズセミコンダクター（株）（３Ｆのみ使用可）,富山県砺波市東開発271,,,,36.6499497387039,137.001802924529,
557,E1620800067111,砺波高校（体育館）,富山県砺波市東幸町3-36,,「洪水時」２階以上に避難,,36.63604141,136.9604831,
558,E1620800068111,Ｂ＆Ｇ海洋センター,富山県砺波市東保20-1,,,,36.65952974,137.028339,
559,E1620800069111,東般若農村振興会館,富山県砺波市東保708,1,,,36.65857201,137.0179134,
560,E1620800070112,般若中学校,富山県砺波市徳万100,1,,,36.63225132,137.0147561,
561,E1620800070111,般若中学校　柔道場,富山県砺波市徳万100,1,,,36.63279147,137.0142823,
562,E1620800071111,般若農業構造改善センター,富山県砺波市徳万56,,,,36.63004428,137.0138424,
563,E1620800072111,富山県砺波青少年自然の家,富山県砺波市徳万字赤坂17-5,,,,36.6231172766747,137.023596314659,
564,E1620800073111,出町中学校,富山県砺波市表町18-29,1,,,36.63454927975,136.948689922413,
565,E1620800074111,出町認定こども園,富山県砺波市表町18-3,,,,36.63566571,136.9508112,
566,E1620800075111,砺波体育センター,富山県砺波市表町18-6,,,,36.6351435861977,136.949607411357,
567,E1620800077111,東野尻振興会館,富山県砺波市苗加4232,,,,36.61883437,136.9414056,
568,E1620800079111,栴檀野体育館,富山県砺波市福岡312,,,,36.64721396,137.0274231,
569,E1620800080111,庄下保育所,富山県砺波市矢木105,,,,36.63529415,136.9700556,
570,E1620800081111,庄下振興会館,富山県砺波市矢木24,,「洪水時」２階以上に避難,,36.63366568,136.9729892,
571,E1620800082111,庄西中学校,富山県砺波市矢木525,1,,,36.63882646,136.9793811,
572,E1620800083111,柳瀬体育館,富山県砺波市柳瀬10,,,,36.6471429,136.9970194,
573,E1620800084111,富山県西部体育センター,富山県砺波市柳瀬241,1,,,36.64246869,137.0004235,
574,E1620800085111,柳瀬農村婦人の家,富山県砺波市柳瀬573,,「洪水時」２階以上に避難,,36.64601305,136.9962594,
575,E1620800086111,庄東小学校,富山県砺波市頼成566,1,「洪水時」２階以上に避難,,36.63509727,137.0105807,
576,E1620800087111,北部認定こども園,富山県砺波市林1086,,,,36.6547869488074,136.945482478304,
577,E1620800088111,砺波北部小学校,富山県砺波市林1104,1,,,36.65253484,136.9438649,
578,E1620800089111,林ふれあい会館,富山県砺波市林858,,,,36.64805918,136.9485703,
579,E1621000002111,福野文化創造センター,富山県南砺市やかた100,,,,36.591357,136.918169,
580,E1621000004111,安居交流センター（安居地区会館）,富山県南砺市安居199-2,,,,36.599404,136.887219,
581,E1621000005111,コミュニティ菅の山,富山県南砺市安居300-1,,,,36.597201,136.886484,
582,E1621000007111,高瀬ふれあい体育館,富山県南砺市安清3174,,,,36.564062,136.9298,
583,E1621000008111,井口保育園,富山県南砺市井口116,,,,36.540955,136.928477,
584,E1621000009111,井口体験交流センター,富山県南砺市井口字持掛谷35,,,,36.526651,136.941048,
585,E1621000153111,井波市民センター,富山県南砺市井波520,,,,36.564959,136.9716,
586,E1621000013111,井波社会福祉センター,富山県南砺市井波521,,,,36.565315,136.971809,
587,E1621000014111,井波中学校体育館,富山県南砺市井波700-1,1,,,36.567018,136.972399,
588,E1621000015111,井波社会体育館,富山県南砺市井波700-110,,,,36.566999,136.97173,
589,E1621000016111,旅川福祉交流館,富山県南砺市院林82-1,,,,36.59148,136.910262,
590,E1621000018111,旅川体育館,富山県南砺市院林82-4,,,,36.591116,136.911099,
591,E1621000019111,なんと農業協同組合五箇山支店,富山県南砺市下梨2045,,,,36.4330552,136.9477,
592,E1621000021111,平若者センター「春光荘」（平交流センター）,富山県南砺市下梨2271,,,,36.432689,136.95096,
593,E1621000022111,平みどり保育園,富山県南砺市下梨2580,,,,36.433574,136.953022,
594,E1621000023111,平中学校体育館,富山県南砺市下梨446,1,,,36.431843,136.943763,
595,E1621000024111,上平小学校体育館,富山県南砺市皆葎1573,1,,,36.402344,136.924195,
596,E1621000025111,山野保育園,富山県南砺市岩屋155,1,,,36.581908,136.958452,
597,E1621000163111,温浴施設３７ＢＡＳＥ,富山県南砺市岩屋16-1,,,,36.57885,136.95564,
598,E1621000027111,福野北部体育館,富山県南砺市岩武新111,,,,36.609737,136.920105,
599,E1621000028111,いのくち椿館,富山県南砺市宮後188,1,,,36.543185,136.928442,
600,E1621000030111,なんと農業協同組合本店,富山県南砺市金戸268-1,1,,,36.5172703,136.8952,
601,E1621000032111,福野南部交流センター（玉成会館）,富山県南砺市広安333-3,,,,36.573168,136.916666,
602,E1621000033111,福野南部コミュニティセンター,富山県南砺市広安338-2,,,,36.573108,136.917022,
603,E1621000037111,福光東部かがやき保育園,富山県南砺市荒木1305-1,,,,36.5576775,136.8803801,
604,E1621000035111,福光東部小学校体育館,富山県南砺市荒木456,1,,,36.556028,136.888171,
605,E1621000036111,福光東部体育館,富山県南砺市荒木460,,,,36.556389,136.88624,
606,E1621000034111,吉江交流センター,富山県南砺市荒木5382-1,,,,36.55923,136.878981,
607,E1621000038111,吉江中学校体育館,富山県南砺市荒木581,1,,,36.55703,136.883039,
608,E1621000041111,高瀬交流センター,富山県南砺市高瀬724-2,,,,36.565666,136.948184,
609,E1621000043111,南蟹谷体育館,富山県南砺市砂子谷1441,1,,,36.592018,136.807954,
610,E1621000044111,南蟹谷交流センター,富山県南砺市砂子谷1500,,,,36.592112,136.808655,
611,E1621000045111,西太美交流センター,富山県南砺市才川七1744-3,1,,,36.526569,136.847071,
612,E1621000155113,笹嶋工業本社（旧社屋）,富山県南砺市三ツ屋28,1,,,36.584789,136.8918,
613,E1621000155112,笹嶋工業本社（新社屋）,富山県南砺市三ツ屋28,1,,,36.584345,136.8918,
614,E1621000046111,井波小学校体育館,富山県南砺市山見1368,1,,,36.565861,136.96256,
615,E1621000047111,井波総合文化センター,富山県南砺市山見1400,1,,,36.567412,136.963906,
616,E1621000048111,井波コミュニティプラザ「アスモ」（井波交流センター）,富山県南砺市山見1739-2,,,,36.566,136.968538,
617,E1621000050111,認定こども園井波にじいろ保育園,富山県南砺市山見2000-14,,,,36.566034,136.967038,
618,E1621000051111,福野体育館,富山県南砺市寺家321-1,,,,36.587489,136.916298,
619,E1621000053111,福野おひさま保育園,富山県南砺市柴田屋209,,,,36.596082,136.914305,
620,E1621000054112,南砺つばき学舎第１体育館,富山県南砺市蛇喰1001,1,,,36.541246,136.928541,
621,E1621000054111,南砺つばき学舎第２体育館,富山県南砺市蛇喰1001,1,,,36.54214,136.928762,
622,E1621000154111,井口市民センター（井口交流センター）,富山県南砺市蛇喰1009,,,,36.542095,136.9303,
623,E1621000161111,旧北山田保育園,富山県南砺市宗守458,,,,36.555263369662,136.9047790731,
624,E1621000055111,北山田交流センター,富山県南砺市宗守458-1,1,,,36.555693,136.904866,
625,E1621000056111,福光南部あおぞら保育園,富山県南砺市小坂694-8,,,,36.533956,136.857402,
626,E1621000057111,福光南部小学校体育館,富山県南砺市小坂708,1,,,36.532562,136.857579,
627,E1621000157111,ぬく森の郷（新館）,富山県南砺市小又311,1,,,36.567803,136.8137,
628,E1621000059111,上平高齢者コミュニティセンター「ことぶき館」,富山県南砺市上平細島1110,,,,36.401983,136.901641,
629,E1621000158111,上平市民センター,富山県南砺市上平細島879,,,,36.401754,136.8996,
630,E1621000060111,上梨コミュニティセンター,富山県南砺市上梨640,,,,36.411426,136.930703,
631,E1621000061112,城端市民センター,富山県南砺市城端1046,,,,36.512201,136.9005,
632,E1621000061111,城端伝統芸能会館,富山県南砺市城端1046,,,,36.512721,136.900365,
633,E1621000063111,城端小学校体育館,富山県南砺市城端1610,,,,36.511735,136.896975,
634,E1621000065111,城端別院善徳寺庫裏,富山県南砺市城端405,1,,,36.5162298,136.9014,
635,E1621000065112,城端別院善徳寺本堂,富山県南砺市城端405,1,,,36.5156134,136.9011,
636,E1621000066111,城端勤労青少年ホーム（城端交流センター）,富山県南砺市城端969-1,,,,36.51351,136.9008,
637,E1621000067111,なんと農業協同組合旧上平事務所,富山県南砺市新屋3,,,,36.3840141,136.8743,
638,E1621000068111,高瀬西交流センター,富山県南砺市森清3148,,,,36.563444,136.930257,
639,E1621000070111,みどり館,富山県南砺市菅沼855,,,,36.401981,136.88012,
640,E1621000072111,上平交流センター,富山県南砺市西赤尾町277,,,,36.38164439531,136.87184345883,
641,E1621000074111,上平自然環境活用センター「ささら館」,富山県南砺市西赤尾町72-1,,,,36.37747,136.87135,
642,E1621000075111,南山見交流センター,富山県南砺市川原崎15,1,,,36.552828,136.955037,
643,E1621000076111,石黒交流センター,富山県南砺市川西385,1,,,36.570738,136.86636,
644,E1621000077111,城端中学校体育館,富山県南砺市泉沢700,1,,,36.506725,136.894212,
645,E1621000079111,広瀬舘交流センター,富山県南砺市祖谷28-1,,,,36.540084,136.852498,
646,E1621000082111,五箇山青少年ふるさとセンター,富山県南砺市相倉163,,,,36.425166,136.935955,
647,E1621000083111,太美山交流センター,富山県南砺市太美1,,,,36.504512,136.847869,
648,E1621000085111,大鋸屋交流センター別館,富山県南砺市大鋸屋120,1,,,36.499294,136.900742,
649,E1621000086111,大鋸屋交流センター,富山県南砺市大鋸屋123,,,,36.498961,136.900165,
650,E1621000087112,旧山田保育園,富山県南砺市大塚60,1,,,36.539178201293,136.889111768,
651,E1621000087111,山田交流センター,富山県南砺市大塚60,1,,,36.539257,136.888697,
652,E1621000088111,南砺平高等学校体育館,富山県南砺市大島1203,,,,36.431311,136.953859,
653,E1621000102111,広瀬交流センター,富山県南砺市竹内241,1,,,36.552815,136.857727,
654,E1621000091111,東太美交流センター,富山県南砺市土生新522-3,,,,36.529335,136.863396,
655,E1621000092111,上平保育園,富山県南砺市東赤尾10,,,,36.383302,136.874298,
656,E1621000095111,たいらマウンテンスクール,富山県南砺市東中江790,1,,,36.44197,136.97228,
657,E1621000096111,福野児童センター「アルカス」,富山県南砺市二日町435-1,,,,36.594552,136.917783,
658,E1621000097111,福野小学校第１体育館,富山県南砺市二日町50,1,,,36.596066,136.915778,
659,E1621000097112,福野小学校第２体育館,富山県南砺市二日町50,1,,,36.59595,136.915027,
660,E1621000099111,山野交流センター,富山県南砺市飛騨屋20,,,,36.581859,136.957167,
661,E1621000100111,福野ひまわり保育園,富山県南砺市百町101-1,,,,36.590123,136.931678,
662,E1621000101111,福野東部体育館,富山県南砺市百町5-1,,,,36.58668,136.935976,
663,E1621000001112,南砺福野高等学校セミナーハウス（志学館）,富山県南砺市苗島443,1,,,36.589139238292,136.92910451864,
664,E1621000001113,南砺福野高等学校第２体育館,富山県南砺市苗島443,1,,,36.590468,136.928505,
665,E1621000001115,南砺福野高等学校第１体育館,富山県南砺市苗島443,1,,,36.590585,136.928098,
666,E1621000103111,福野Ｂ＆Ｇ海洋センター,富山県南砺市苗島4799,,,,36.587309,136.917032,
667,E1621000160111,福野市民センター,富山県南砺市苗島4880,,,,36.58798,136.9194,
668,E1621000104111,アクティブ東石黒,富山県南砺市布袋43-3,,,,36.578167,136.893039,
669,E1621000105111,福野西部交流センター,富山県南砺市布袋48-1,,,,36.578882,136.89322,
670,E1621000108111,福光青少年センター,富山県南砺市福光1137,,,,36.557837,136.870298,
671,E1621000108112,福光交流センター,富山県南砺市福光1137,,,,36.557893,136.869796,
672,E1621000110111,福光児童館「きっずらんど」,富山県南砺市福光1269-1,,,,36.552297,136.870647,
673,E1621000112111,楽蔵グリーンモール福光,富山県南砺市福光288-1,1,,,36.564176647353,136.87052189814,
674,E1621000113111,福光どんぐり保育園,富山県南砺市福光381-1,,,,36.564825,136.869188,
675,E1621000114111,福光福祉会館,富山県南砺市福光5260,,,,36.557624,136.87061,
676,E1621000115111,福光体育館,富山県南砺市福光616,,,,36.559395,136.863871,
677,E1621000117111,福光中学校体育館,富山県南砺市福光720,1,,,36.559663,136.863051,
678,E1621000118112,福野中学校第１体育館,富山県南砺市福野1339,1,,,36.59116,136.92466,
679,E1621000118113,福野中学校第２体育館,富山県南砺市福野1339,1,,,36.590893,136.925379,
680,E1621000120111,福光中部小学校体育館,富山県南砺市法林寺1,1,,,36.562213,136.861786,
681,E1621000121111,福光西部体育館,富山県南砺市法林寺18-2,,,,36.561093,136.861304,
682,E1621000123111,井波八乙女体育館,富山県南砺市北川166-1,,,,36.569708,136.971177,
683,E1621000126111,北野交流センター,富山県南砺市北野1193-1,,,,36.52825,136.918768,
684,E1621000128111,蓑谷交流センター,富山県南砺市蓑谷1167,1,,,36.509335,136.919694,
685,E1621000130111,福野北部交流センター（近思会館）,富山県南砺市野尻652-2,,,,36.604282,136.918959,
686,E1621000132111,福野東部交流センター（東部会館）,富山県南砺市野新393,,,,36.583218,136.934138,
687,E1621000133111,南山田交流センター,富山県南砺市野田1369,,,,36.522036,136.900647,
688,E1621000134111,城端西部体育館,富山県南砺市野田78-2,,,,36.517669,136.895195,
689,E1621000152111,利賀市民センター（利賀交流センター）,富山県南砺市利賀村171,,,,36.457523,137.0263,
690,E1621000135112,複合教育施設「アーパス」体育館,富山県南砺市利賀村184,1,,,36.456164,137.029292,
691,E1621000135111,利賀交流センター,富山県南砺市利賀村184,1,,,36.455981,137.029743,
692,E1621000136111,旧利賀小学校下原分校,富山県南砺市利賀村下原384,,,,36.528714,136.988463,
693,E1621000138111,利賀ささゆり保育園,富山県南砺市利賀村坂上33,,,,36.429564,137.005352,
694,E1621000142111,利賀中村体育館,富山県南砺市利賀村上百瀬50,,,,36.440004,137.038475,
