695,E1621000146111,豆谷体験学習集会施設,富山県南砺市利賀村北豆谷2,,,,36.472782,137.032274,
696,E1621000147111,城端さくら保育園,富山県南砺市理休240,,,,36.513678,136.909224,
697,E1621000148111,城端東部体育館,富山県南砺市理休429,,,,36.512947,136.906053,
698,E1621000149111,桜ヶ池クアガーデン,富山県南砺市立野原東1184,,,,36.499841,136.871876,
699,E1621000150111,桜ヶ池農産物直売所,富山県南砺市立野原東1509,,,,36.500856,136.87167,
700,E1634200003111,小摺戸地区公民館,富山県入善町一宿622-1,1,,,36.89795748,137.5083834,
701,E1634200006112,横山地区交流防災センター,富山県入善町横山81,1,,,36.95510511,137.5185794,
702,E1634200006111,勤労者総合スポーツ施設【サンビレッジ】,富山県入善町横山81,1,,,36.95524657,137.5179839,
703,E1634200013111,舟見交流センター,富山県入善町舟見1863,1,,,36.88352191,137.5509796,
704,E1634200014111,社会体育館,富山県入善町舟見1870,1,,,36.88408022,137.5514929,
705,E1634200015111,ひばり野保育所,富山県入善町舟見584-1,1,,,36.89118725,137.5481185,
706,E1634200016111,ひばり野小学校,富山県入善町舟見590-1,1,,,36.89161463,137.5477427,
707,E1634200018111,こあら保育所,富山県入善町小摺戸394,1,,,36.89834276,137.5179218,
708,E1634200019111,黒東小学校,富山県入善町小摺戸402,1,,,36.89952339,137.5176813,
709,E1634200024111,上青小学校,富山県入善町上野210,1,,,36.9292464,137.4865588,
710,E1634200025111,さわすぎ保育所,富山県入善町上野255-1,1,,,36.9302861,137.488232,
711,E1634200026121,おあしす新川,富山県入善町上野2803,1,,要配慮者等,36.92449222,137.5024998,
712,E1634200027111,老人福祉センター,富山県入善町上野403-2,1,,,36.9305351,137.4916949,
713,E1634200028111,入善西中学校,富山県入善町上野549,1,,,36.92869751,137.4921164,
714,E1634200029111,産業展示会館,富山県入善町上野777-1,1,,,36.93294274,137.4919179,
715,E1634200032111,新屋公民館,富山県入善町新屋2541,1,,,36.89752999,137.522575,
716,E1634200035111,広域働く婦人の家,富山県入善町青木170-1,1,,,36.92441836,137.4814053,
717,E1634200037111,いいの保育所,富山県入善町東狐101-1,1,,,36.923822,137.45671,
718,E1634200038111,飯野小学校,富山県入善町東狐171,1,,,36.92402995,137.4591428,
719,E1634200039111,飯野コミュニティ防災センター,富山県入善町東狐171-1,1,,,36.92437303,137.4604142,
720,E1634200040111,勤労者福祉センター,富山県入善町入膳2973-10,1,,,36.93504355,137.5004553,
721,E1634200041111,町民会館,富山県入善町入膳3200,1,,,36.93416853,137.5016598,
722,E1634200042111,にゅうぜん保育所,富山県入善町入膳3837-1,1,,,36.936445947993,137.50383224542,
723,E1634200043111,入善小学校,富山県入善町入膳3945,1,,,36.93586875,137.5048504,
724,E1634200044111,入善高等学校（体育館・武道場・同窓会館・グラウンド）,富山県入善町入膳3963,1,,,36.93366766,137.505413,
725,E1634200045111,児童センター,富山県入善町入膳4517-3,1,,,36.93642107,137.5061967,
726,E1634200046111,屋内多目的施設,富山県入善町入膳456,1,,,36.923535477032,137.5059730572,
727,E1634200047111,総合体育館,富山県入善町入膳468,1,,,36.92406345,137.5040404,
728,E1634200048111,入善中学校,富山県入善町入膳4849,1,,,36.93816699,137.5068943,
729,E1634200050111,うるおい館,富山県入善町入膳5232-5,1,,,36.9385786,137.501385,
730,E1634200057111,野中地区交流センター,富山県入善町野中410,1,,,36.90378075,137.5461178,
731,E1634200061111,椚山公民館,富山県入善町椚山3529-1,1,,,36.93738913,137.5164186,
732,E1634200063111,桃李小学校,富山県入善町椚山813,1,,,36.94384619,137.5177597,
733,E1634200064111,とうり保育所,富山県入善町椚山846-1,1,,,36.942694,137.516465,
734,E1620500001111,海峰小学校,富山県氷見市阿尾1015,1,,,36.88473196,136.9879434,
735,E1620500011111,氷見市ふれあいスポーツセンター,富山県氷見市鞍川43-1,1,,,36.85272228,136.97424,
736,E1620500019111,八代自治会館,富山県氷見市磯辺14-1,1,,,36.91907109,136.949472,
737,E1620500021111,旧一刎小学校,富山県氷見市一刎721,1,,,36.91391384,136.9275955,
738,E1620500023111,氷見市稲積公民館,富山県氷見市稲積1281,1,,,36.87493424,136.9758702,
739,E1620500027111,旧灘浦小学校,富山県氷見市宇波1194,1,,,36.91604797,137.0098348,
740,E1620500039111,北部中学校,富山県氷見市加納135,1,,,36.8717517,136.971342,
741,E1620500041111,加納地域まちづくりセンター,富山県氷見市加納3693,1,,,36.86423085,136.969729,
742,E1620500062111,窪小学校,富山県氷見市窪1237,1,,,36.83898746,136.9911219,
743,E1620500079111,氷見高等学校,富山県氷見市幸町17-1,1,,,36.85349285,136.9800555,
744,E1620500097111,速川公民館（旧速川小学校）,富山県氷見市小久米93,1,,,36.84829383,136.9050734,
745,E1620500098111,灘浦小学校,富山県氷見市小境1420,1,,,36.91985973,137.0250209,
746,E1620500100111,西の杜学園,富山県氷見市小窪1379,1,,,36.85501381,136.9088449,
747,E1620500112111,碁石公民館,富山県氷見市上余川330,1,,,36.8865613,136.92864,
748,E1620500114111,久目地区交流館（旧久目小学校）,富山県氷見市触坂501,1,,,36.83115248,136.8904544,
749,E1620500126111,上庄小学校,富山県氷見市泉338,1,,,36.86678751,136.9430652,
750,E1620500130111,仏生寺公民館,富山県氷見市惣領1927,1,,,36.79742782,136.9432546,
751,E1620500145111,明和公民館（旧明和小学校）,富山県氷見市谷屋19,1,,,36.8697746,136.9118203,
752,E1620500162112,南部中学校,富山県氷見市朝日丘3-1,1,,,36.85011159,136.9804829,
753,E1620500162111,朝日丘小学校,富山県氷見市朝日丘3-1,1,,,36.85016012,136.9807467,
754,E1620500169111,赤毛コミュニティセンター,富山県氷見市坪池12-2,1,,,36.79917536,136.8732604,
755,E1620500175111,宮田小学校,富山県氷見市島尾258,1,,,36.82006017,137.0048128,
756,E1620500184111,十三中学校,富山県氷見市飯久保1406,1,,,36.80824132,136.9568948,
757,E1620500185111,十三公民館,富山県氷見市飯久保168,1,,,36.80863723,136.9573717,
758,E1620500186111,湖南小学校,富山県氷見市飯久保473,1,,,36.80938445,136.9635147,
759,E1620500193111,比美乃江小学校,富山県氷見市北大町13-50,1,,,36.86203543,136.9814816,
760,E1620500205111,十二町小学校,富山県氷見市万尾485,1,,,36.83264776,136.9588077,
761,E1620500210111,西條中学校,富山県氷見市柳田3223,1,,,36.8298442,137.0054968,
762,E1620500215111,余川公民館,富山県氷見市余川1180,1,,,36.88220683,136.9523261,
763,E1620100002111,旧安野屋小学校体育館,富山県富山市安野屋町1-1-42,1,,,36.69424,137.202615,
764,E1620100003111,庵谷地区公民館,富山県富山市庵谷575-1,1,,,36.508709,137.229834,
765,E1620100007111,奥田中学校,富山県富山市奥井町25-10,1,,,36.701854,137.225706,
766,E1620100008111,奥田小学校,富山県富山市奥田双葉町10-18,1,,,36.708122,137.221155,
767,E1620100009111,岡田公民館（旧上滝公民館岡田分館）,富山県富山市岡田781,1,,,36.582746,137.326586,
768,E1620100011111,興南中学校,富山県富山市下熊野728,1,,,36.634278,137.212192,
769,E1620100012111,奥田北小学校,富山県富山市下新北町3-72,1,,,36.719318,137.220611,
770,E1620100013111,大久保ふれあいセンター,富山県富山市下大久保1776-1,1,,,36.605104,137.208066,
771,E1620100014111,大久保小学校,富山県富山市下大久保2430,1,,,36.604529,137.204395,
772,E1620100015111,富山市民球場,富山県富山市下飯野30-1,1,,,36.730608,137.262086,
773,E1620100016111,富山東高校,富山県富山市下飯野荒田6-1,1,,,36.74095,137.256756,
774,E1620100017111,大山社会体育館,富山県富山市花崎378,1,,,36.611271,137.290665,
775,E1620100018111,大山総合体育センター,富山県富山市花崎386,1,,,36.610713,137.290695,
776,E1620100021111,蟹寺地区公民館,富山県富山市蟹寺153,1,,,36.461964,137.24361,
777,E1620100022111,富山県漕艇場,富山県富山市岩稲20-1,1,,,36.54777,137.226946,
778,E1620100023111,岩稲地区公民館,富山県富山市岩稲419,1,,,36.549843,137.224815,
779,E1620100024111,岩瀬小学校,富山県富山市岩瀬御蔵町1,1,,,36.754188,137.230574,
780,E1620100029111,富山短期大学,富山県富山市願海寺444,1,,,36.721183,137.139494,
781,E1620100316111,富山国際大学付属高等学校,富山県富山市願海寺水口444,1,,,36.722039,137.140475,
782,E1620100032111,熊野小学校,富山県富山市宮保602,1,,,36.629346,137.221072,
783,E1620100036111,富山総合支援学校,富山県富山市金屋4982,1,,,36.69228,137.165585,
784,E1620100037111,営農サポートセンター,富山県富山市月岡町3-101,1,,,36.634142,137.251327,
785,E1620100039111,古沢小学校,富山県富山市古沢501,1,,,36.691601,137.141257,
786,E1620100040111,中央小学校,富山県富山市五番町4-35,1,,,36.686964,137.219482,
787,E1620100041111,西部中学校,富山県富山市五福130,1,,,36.703321,137.190003,
788,E1620100042111,富山工業高校,富山県富山市五福2238,1,,,36.698519,137.193533,
789,E1620100043111,富山大学五福キャンパス,富山県富山市五福3190,1,,,36.699312,137.186103,
790,E1620100045111,五福小学校,富山県富山市五福4431-2,1,,,36.70228029,137.184582,
791,E1620100048111,富山大学附属小・中学校,富山県富山市五艘1300,1,,,36.705228,137.194911,
792,E1620100049111,呉羽高校,富山県富山市呉羽町2070-5,1,,,36.716828,137.161363,
793,E1620100050111,富山市民芸術創造センター,富山県富山市呉羽町2247-3,1,,,36.71697407,137.1647623,
794,E1620100051111,呉羽小学校,富山県富山市呉羽町6171,1,,,36.713886,137.169028,
795,E1620100052111,呉羽中学校,富山県富山市呉羽町6662,1,,,36.712375,137.164895,
796,E1620100054111,富山県技術専門学院,富山県富山市向新庄町1-14-48,1,,,36.700538,137.262473,
797,E1620100055111,富山第一高校,富山県富山市向新庄町5-1-54,1,,,36.706625,137.265264,
798,E1620100058111,新庄中学校,富山県富山市荒川5-4-18,1,,,36.694394,137.253705,
799,E1620100060111,神明小学校,富山県富山市高田147-2,1,,,36.686201,137.184558,
800,E1620100064111,大沢野小学校,富山県富山市高内144,1,,,36.577642,137.206353,
801,E1620100066111,萩浦小学校,富山県富山市高畠町2-11-28,1,,,36.74643,137.229759,
802,E1620100071111,船峅小学校,富山県富山市坂本1733,1,,,36.585483,137.223966,
803,E1620100072111,富山高等支援学校,富山県富山市坂本2600,1,,,36.586411,137.214291,
804,E1620100073111,船峅公民館,富山県富山市坂本482,1,,,36.583688,137.221539,
805,E1620100076111,笹津会館,富山県富山市笹津495,1,,,36.562368,137.213234,
806,E1620100077111,山室中学校,富山県富山市山室30-1,1,,,36.668552,137.240693,
807,E1620100079111,山室中部小学校,富山県富山市山室荒屋162-2,1,,,36.67185,137.253602,
808,E1620100081111,東部地区集会場（沢連）,富山県富山市山田宿坊823,1,,,36.583455,137.097037,
809,E1620100082111,西部地区集会場（清水）,富山県富山市山田清水7,1,,,36.589492,137.049224,
810,E1620100083111,山田交流促進センター,富山県富山市山田赤目谷145,1,,,36.579935,137.064937,
811,E1620100084111,南部地区集会場（谷）,富山県富山市山田谷425,1,,,36.551109,137.063537,
812,E1620100085111,山田総合体育センター,富山県富山市山田中瀬2,1,,,36.587471,137.084196,
813,E1620100086111,山田公民館,富山県富山市山田湯880,1,,,36.580053,137.080844,
814,E1620100087111,山田小・中学校,富山県富山市山田北山41,1,,,36.5847,137.080571,
815,E1620100089111,四方小学校,富山県富山市四方405,1,,,36.754912,137.195478,
816,E1620100093111,富山中部高校,富山県富山市芝園町3-1-26,1,,,36.695882,137.203698,
817,E1620100093112,芝園小学校,富山県富山市芝園町3-1-26,1,,,36.69669,137.204492,
818,E1620100093113,芝園中学校,富山県富山市芝園町3-1-26,1,,,36.697035,137.204354,
819,E1620100096111,猿倉コミュニティセンター,富山県富山市舟新81-1,1,,,36.560027,137.220895,
820,E1620100097111,下タ南部公民館（体育館）,富山県富山市舟渡66,1,,,36.470854,137.242972,
821,E1620100097112,下タ南部公民館,富山県富山市舟渡66,1,,,36.471098,137.24289,
822,E1620100098111,大沢野健康福祉センター（ウインディ）,富山県富山市春日96-1,1,,,36.561304,137.20223,
823,E1620100099111,旧小羽小学校（体育館）,富山県富山市小羽279,1,,,36.56497,137.189973,
824,E1620100100111,小羽公民館,富山県富山市小羽361,1,,,36.564573,137.191424,
825,E1620100101111,小見小学校,富山県富山市小見250,1,,,36.574347,137.384049,
826,E1620100103111,富山商業高校,富山県富山市庄高田413,1,,,36.693026,137.188356,
827,E1620100104111,月岡小学校,富山県富山市上千俵町500,1,,,36.622538,137.252915,
828,E1620100107111,旧大沢野北部地区福祉センター,富山県富山市上大久保187,1,,,36.586493,137.207665,
829,E1620100108111,上滝小学校,富山県富山市上滝517,1,,,36.609758,137.30096,
830,E1620100113111,新庄小学校,富山県富山市新庄町1-6-30,1,,,36.702115,137.251822,
831,E1620100115111,新庄北小学校,富山県富山市新庄本町2-4-11,1,,,36.711098,137.26298,
832,E1620100119111,雄峰高校,富山県富山市神通町2-12-10,1,,,36.701221,137.20677,
833,E1620100120111,針原小学校,富山県富山市針原中町523-1,1,,,36.729686,137.267702,
834,E1620100122111,富山学園,富山県富山市針日225,1,,,36.759721,137.260375,
835,E1620100125111,水橋中学校,富山県富山市水橋舘町443,1,,,36.75095,137.307017,
836,E1620100130111,三成小学校,富山県富山市水橋小路345,1,,,36.721096,137.292954,
837,E1620100131111,水橋東部小学校,富山県富山市水橋上桜木114,1,,,36.739732,137.324639,
838,E1620100133111,三成中学校,富山県富山市水橋石割70,1,,,36.722435,137.312816,
839,E1620100136111,旧上条小学校（体育館）,富山県富山市水橋石割99,1,,,36.72648514,137.31410801,
840,E1620100139111,水橋中部小学校,富山県富山市水橋町568,1,,,36.751667,137.307042,
841,E1620100141111,水橋西部小学校,富山県富山市水橋辻ヶ堂1919-2,1,,,36.752123,137.300039,
842,E1620100144111,富山大学杉谷キャンパス,富山県富山市杉谷2630,1,,,36.679788,137.141932,
843,E1620100145111,旧星井町小学校（体育館）,富山県富山市星井町2-7-29,1,,,36.684585,137.212977,
844,E1620100147111,旧清水町小学校（体育館）,富山県富山市清水町8-1-1,1,,,36.685612,137.224024,
845,E1620100148111,池多小学校,富山県富山市西押川1442,1,,,36.682891,137.120061,
846,E1620100149111,富山県呉羽青少年自然の家,富山県富山市西金屋8194,1,,,36.69551872,137.1507305,
847,E1620100150111,西笹津集落センター,富山県富山市西笹津258,1,,,36.556704,137.21581,
848,E1620100154111,西田地方小学校,富山県富山市西田地方町1-1-25,1,,,36.685099,137.20642,
849,E1620100155111,南部中学校,富山県富山市西田地方町2-10-10,1,,,36.682767,137.206632,
850,E1620100158111,東部小学校,富山県富山市石金1-5-44,1,,,36.69039,137.235636,
851,E1620100159111,龍谷富山高校,富山県富山市赤江町2-10,1,,,36.701249,137.219021,
852,E1620100161111,蜷川小学校,富山県富山市赤田75-1,1,,,36.654223,137.222151,
853,E1620100163111,大庄小学校,富山県富山市善名453,1,,,36.619067,137.279102,
854,E1620100167111,旧総曲輪小学校（体育館）,富山県富山市総曲輪4-4-7,1,,,36.690442,137.209585,
855,E1620100168111,草島小学校,富山県富山市草島93,1,,,36.745307,137.208025,
856,E1620100169111,太田小学校,富山県富山市太田14-2,1,,,36.653771,137.25095,
857,E1620100170111,富山高校,富山県富山市太郎丸1,1,,,36.672595,137.217398,
858,E1620100171111,富山視覚総合支援学校,富山県富山市大江干144,1,,,36.693803,137.267844,
859,E1620100174111,大泉中学校,富山県富山市大泉東町2-11-26,1,,,36.678994,137.228325,
860,E1620100176111,山室小学校,富山県富山市中市2-10-5,1,,,36.678746,137.240125,
861,E1620100178111,上滝中学校,富山県富山市中滝160,1,,,36.610404,137.292513,
862,E1620100179111,月岡中学校,富山県富山市中布目156,1,,,36.617282,137.251912,
863,E1620100180111,老田小学校,富山県富山市中老田317,1,,,36.707771,137.131882,
864,E1620100181111,細入南部公民館,富山県富山市猪谷851-1,1,,,36.473022,137.238392,
865,E1620100182111,猪谷関所館,富山県富山市猪谷978-4,1,,,36.471344,137.239315,
866,E1620100183111,長岡小学校,富山県富山市長岡9420,1,,,36.719782,137.189089,
867,E1620100184111,東部中学校,富山県富山市長江新町4-4-60,1,,,36.691451,137.242943,
868,E1620100185111,２０００年体育館,富山県富山市天正寺1400,1,,,36.680758,137.249973,
869,E1620100186111,桜谷小学校,富山県富山市田刈屋279,1,,,36.708279,137.199077,
870,E1620100187111,大広田小学校,富山県富山市田畑183,1,,,36.754252,137.252846,
871,E1620100189111,不二越工業高校,富山県富山市東石金町7-5,1,,,36.68511,137.238726,
872,E1620100190111,高朋高校,富山県富山市東富山寿町1-1-39,1,,,36.748776,137.252949,
873,E1620100192111,北部中学校,富山県富山市東富山寿町2-4-52,1,,,36.747919,137.249548,
874,E1620100193111,大山農村環境改善センター,富山県富山市東福沢1818,1,,,36.601655,137.254396,
875,E1620100194111,福沢小学校,富山県富山市東福沢46-4,1,,,36.603436,137.256935,
876,E1620100195111,藤ノ木小学校,富山県富山市藤木1246,1,,,36.686873,137.26815,
877,E1620100197111,広田小学校,富山県富山市鍋田22-53,1,,,36.713522,137.246989,
878,E1620100199111,光陽小学校,富山県富山市二口町1-4-1,1,,,36.673155,137.203756,
879,E1620100200111,日尾公民館（旧瀬戸集落センター）,富山県富山市日尾214-1,1,,,36.57709716998,137.27353321958,
880,E1620100201111,藤ノ木中学校,富山県富山市日俣222,1,,,36.691873,137.273544,
881,E1620100202111,新保小学校,富山県富山市任海888-2,1,,,36.634606,137.194799,
882,E1620100203111,旧八人町小学校（体育館）,富山県富山市八人町5-17,1,,,36.693392,137.217295,
883,E1620100205111,八幡小学校,富山県富山市八幡670,1,,,36.740874,137.196146,
884,E1620100206111,八尾スポーツアリーナ,富山県富山市八尾町井田101,1,,,36.601364,137.143735,
885,E1620100232111,八尾中学校,富山県富山市八尾町井田120-1,1,,,36.599681,137.14345,
886,E1620100208111,八尾コミュニティセンター,富山県富山市八尾町井田126,1,,,36.600419,137.143599,
887,E1620100209111,卯花公民館,富山県富山市八尾町下笹原42-1,1,,,36.564306,137.149697,
888,E1620100207111,八尾小学校,富山県富山市八尾町下笹原5320,1,,,36.576042,137.137924,
889,E1620100210111,八尾ゆめの森交流施設（中山間地活性化施設）,富山県富山市八尾町下笹原678-1,1,,,36.568937,137.140706,
890,E1620100211111,旧黒瀬谷公民館,富山県富山市八尾町樫尾162,1,,,36.571063,137.159632,
891,E1620100212111,桐谷防雪センター,富山県富山市八尾町桐谷2055,1,,,36.521121,137.181925,
892,E1620100213111,保内小学校,富山県富山市八尾町高善寺162,1,,,36.611102,137.136991,
893,E1620100214111,杉原小学校,富山県富山市八尾町黒田3636,1,,,36.600206,137.162715,
894,E1620100215111,仁歩公民館,富山県富山市八尾町三ッ松14-1,1,,,36.529579,137.097151,
895,E1620100216111,旧樫尾小学校,富山県富山市八尾町小長谷349,1,,,36.57542036,137.1550643,
896,E1620100217111,黒瀬谷公民館,富山県富山市八尾町小長谷352,1,,,36.575525,137.154166,
897,E1620100218111,八尾曳山展示館,富山県富山市八尾町上新町2898-1,1,,,36.576115,137.130619,
898,E1620100219111,保内公民館,富山県富山市八尾町新田101,1,,,36.605835,137.131552,
899,E1620100220111,野積公民館,富山県富山市八尾町水口242,1,,,36.548828,137.124731,
900,E1620100221111,杉原公民館,富山県富山市八尾町大杉12,1,,,36.601385,137.162867,
901,E1620100223111,室牧公民館,富山県富山市八尾町中242,1,,,36.570998,137.111785,
902,E1620100224111,八尾公民館,富山県富山市八尾町東町2108-10,1,,,36.5766724466199,137.136300654138,
903,E1620100225111,八尾ふらっと館,富山県富山市八尾町東町2149,1,,,36.578377,137.138104,
904,E1620100226111,大長谷交流センター,富山県富山市八尾町内名88,1,,,36.479269,137.080362,
905,E1620100227111,林業総合センター,富山県富山市八尾町梅苑町1-95-1,1,,,36.570275,137.136845,
906,E1620100227112,八尾農村環境改善センター,富山県富山市八尾町梅苑町1-95-1,1,,,36.570067,137.13743,
907,E1620100228111,広畑防雪センター,富山県富山市八尾町布谷1467-7,1,,,36.517951,137.114728,
908,E1620100229111,八尾行政サービスセンター,富山県富山市八尾町福島200,1,,,36.582861,137.137643,
909,E1620100230111,八尾高校,富山県富山市八尾町福島213,1,,,36.585078,137.130456,
910,E1620100233111,大沢野中学校,富山県富山市八木山550,1,,,36.590554,137.214272,
911,E1620100237111,浜黒崎小学校,富山県富山市浜黒崎3301-2,1,,,36.758354,137.27871,
912,E1620100241111,古里小学校,富山県富山市婦中町羽根43,1,,,36.655772,137.128327,
913,E1620100242111,古里公民館,富山県富山市婦中町羽根6,1,,,36.655346,137.127686,
914,E1620100244111,朝日公民館,富山県富山市婦中町下条281,1,,,36.674721,137.15117,
915,E1620100245111,朝日小学校,富山県富山市婦中町下条5518,1,,,36.67729,137.151804,
916,E1620100246111,しらとり支援学校,富山県富山市婦中町下邑2877,1,,,36.658931,137.127413,
917,E1620100247111,城山中学校,富山県富山市婦中町河原町561-5,1,,,36.64494,137.12249,
918,E1620100248111,婦中体育館音川分館,富山県富山市婦中町外輪野5230-1,1,,,36.629091,137.091937,
919,E1620100249111,音川小学校,富山県富山市婦中町外輪野5959,1,,,36.629737,137.094535,
920,E1620100250111,音川公民館,富山県富山市婦中町外輪野6324-1,1,,,36.629582,137.09371,
921,E1620100251111,宮川公民館,富山県富山市婦中町広田4178,1,,,36.622423,137.168305,
922,E1620100253111,神保小学校,富山県富山市婦中町高日附820,1,,,36.637099,137.135286,
923,E1620100254113,速星公民館,富山県富山市婦中町砂子田1-1,1,,,36.655822,137.163897,
924,E1620100254111,婦中体育館,富山県富山市婦中町砂子田1-1,1,,,36.654542,137.164155,
925,E1620100254112,婦中ふれあい館,富山県富山市婦中町砂子田1-1,1,,,36.655317,137.163895,
926,E1620100255111,速星公民館笹倉分館,富山県富山市婦中町笹倉433,1,,,36.66294,137.155858,
927,E1620100256111,神保公民館,富山県富山市婦中町上吉川403-1,1,,,36.638592,137.137184,
928,E1620100258111,鵜坂公民館,富山県富山市婦中町上田島18-1,1,,,36.669214,137.173742,
929,E1620100259111,鵜坂小学校,富山県富山市婦中町上田島68,1,,,36.668976,137.175487,
930,E1620100260111,婦中中央児童館,富山県富山市婦中町速星750-2,1,,,36.660122,137.160186,
931,E1620100261111,速星小学校,富山県富山市婦中町速星752,1,,,36.660884,137.159507,
932,E1620100262111,富山西高校,富山県富山市婦中町速星926,1,,,36.658545,137.164169,
933,E1620100263111,宮野小学校,富山県富山市婦中町地角399,1,,,36.630532,137.171727,
934,E1620100264111,婦中武道館,富山県富山市婦中町長沢428,1,,,36.645372,137.12311,
935,E1620100266111,速星中学校,富山県富山市婦中町板倉345-1,1,,,36.655306,137.164843,
936,E1620100267111,婦中熊野公民館,富山県富山市婦中町堀657,1,,,36.637931,137.168879,
937,E1620100268111,富山南高校,富山県富山市布市98,1,,,36.648532,137.237129,
938,E1620100270111,下タ北部公民館,富山県富山市布尻991,1,,,36.522055,137.232258,
939,E1620100273111,和合中学校,富山県富山市布目3967,1,,,36.749191,137.186049,
940,E1620100274111,倉垣小学校,富山県富山市布目4002,1,,,36.749091,137.191121,
941,E1620100276111,文珠寺公民館,富山県富山市文珠寺1300-4,1,,,36.603303,137.294895,
942,E1620100277111,東富山体育館,富山県富山市米田16-2,1,,,36.736956,137.247597,
943,E1620100278111,豊田小学校,富山県富山市米田2-1,1,,,36.729921,137.242089,
944,E1620100279111,片掛地区公民館,富山県富山市片掛1981-1,1,,,36.491155,137.235826,
945,E1620100314111,牧公民館,富山県富山市牧814,1,,,36.569757,137.354698,
946,E1620100284111,堀川小学校,富山県富山市堀川小泉町1-13-10,1,,,36.677019,137.220885,
947,E1620100286111,富山いずみ高校,富山県富山市堀川小泉町1-21-1,1,,,36.674841,137.220985,
948,E1620100287111,堀川中学校,富山県富山市堀川小泉町1-21-15,1,,,36.674792,137.222787,
949,E1620100289111,大山Ｂ＆Ｇ海洋センター体育館,富山県富山市本宮12,1,,,36.576731,137.432457,
950,E1620100291111,寒江小学校,富山県富山市本郷中部427,1,,,36.729679,137.153007,
