1214,E2420100413111,修成小学校,三重県津市修成町9-1,1,,,34.71007338,136.5012867,"地震〇津波※洪水〇土砂災害〇高潮〇火災×火山噴火×
※・・・津波警報等発令時は津波避難ビル又は津波避難ビルとして開設"
1215,E2420100778111,三重県立津商業高等学校,三重県津市渋見町699,1,,,34.7363913,136.4981517,地震〇津波〇洪水〇土砂災害〇高潮〇火災×火山噴火× 　
1216,E2420100420111,橋南中学校,三重県津市上弁財町津興2537-4,1,,,34.70275118,136.510782,"地震〇津波※洪水〇土砂災害〇高潮〇火災×火山噴火× 
※・・・津波警報等発令時は津波避難ビル又は津波避難ビルとして開設"
1217,E2420100422121,城山れんげの里,三重県津市城山1-12-2,,,障がい者,34.676153,136.506159,
1218,E2420100423121,朝海ハイム,三重県津市城山1-8-16,,,障がい者,34.676702,136.508985,
1219,E2420100425111,桃園小学校,三重県津市新家町1350,1,,,34.66032916,136.4862905,地震〇津波〇洪水〇土砂災害〇高潮〇火災×火山噴火×
1220,E2420100430111,栗葉小学校,三重県津市森町270,1,,,34.67915265,136.410929,地震〇津波〇洪水×砂災害〇高潮〇火災×火山噴火×
1221,E2420100436111,津市青少年野外活動センター,三重県津市神戸1680-1,1,,,34.711010751642,136.47810842349,地震〇津波〇洪水〇土砂災害〇高潮〇火災×火山噴火×
1222,E2420100437111,神戸小学校,三重県津市神戸332-1,1,,,34.71465787,136.4821266,"地震〇津波※洪水〇土砂災害〇高潮〇火災×火山噴火×
※・・・津波警報等発令時は津波避難ビル又は津波避難ビルとして開設"
1223,E2420100440123,津市たるみ老人福祉センター,三重県津市垂水1300,1,,高齢者,34.685384,136.506014,
1224,E2420100440122,津市たるみ作業所,三重県津市垂水1300,1,,障がい者,34.685411,136.506028,
1225,E2420100440121,津市たるみ子育て交流館,三重県津市垂水1300,1,,妊産婦,34.685773,136.506157,
1226,E2420100441111,南が丘小学校,三重県津市垂水2538-1,1,,,34.69008884,136.4956366,地震〇津波〇洪水〇土砂災害〇高潮〇火災×火山噴火×
1227,E2420100442111,南が丘中学校,三重県津市垂水2622-1,1,,,34.6887391,136.4944618,地震〇津波〇洪水〇土砂災害〇高潮〇火災×火山噴火×
1228,E2420100443111,南が丘会館,三重県津市垂水2882-1,1,,,34.69731811,136.500311,地震〇津波〇洪水〇土砂災害〇高潮〇火災×火山噴火×
1229,E2420100463111,大里小学校,三重県津市大里窪田町1821,1,,,34.7708126655134,136.4924961432813,地震〇津波〇洪水〇土砂災害〇高潮〇火災×火山噴火×
1230,E2420100470111,大里出張所,三重県津市大里睦合町1292-1,1,,,34.77491862,136.4907122,地震〇津波〇洪水〇土砂災害〇高潮〇火災×火山噴火×
1231,E2420100472111,豊里中学校,三重県津市大里睦合町820-1,1,,,34.77714913,136.4841723,地震〇津波〇洪水〇土砂災害〇高潮〇火災×火山噴火×
1232,E2420100473121,養護老人ホーム高田慈光院,三重県津市大里野田町1124-1,,,高齢者,34.784533,136.481632,
1233,E2420100473122,特別養護老人ホーム　高田光寿園,三重県津市大里野田町1124-1,,,高齢者,34.784276,136.481368,
1234,E2420100478111,さくら児童館,三重県津市中河原2075,1,,,34.7265799075531,136.5175875964176,"地震〇津波※洪水〇土砂災害〇高潮×火災×火山噴火×
※・・・津波警報等発令時は津波避難ビル又は津波避難ビルとして開設"
1235,E2420100479111,東橋内中学校,三重県津市中河原356-2,1,,,34.72110716,136.5188555,"地震〇津波※洪水〇土砂災害〇高潮〇火災×火山噴火×
※・・・津波警報等発令時は津波避難ビル又は津波避難ビルとして開設"
1236,E2420100480111,敬和小学校,三重県津市中河原445,1,,,34.72093961,136.5201322,"地震〇津波※洪水〇土砂災害〇高潮〇火災×火山噴火×
※・・・津波警報等発令時は津波避難ビル又は津波避難ビルとして開設"
1237,E2420100481121,特別養護老人ホーム　ときの音色,三重県津市中村町745-25,,,高齢者,34.672283,136.407122,
1238,E2420100483111,西が丘小学校,三重県津市長岡町800-437,1,,,34.74466686,136.4917821,地震〇津波〇洪水〇土砂災害〇高潮〇火災×火山噴火×
1239,E2420100485121,介護老人保健施設　トマト,三重県津市殿村860-2,,,高齢者,34.726678,136.463917,
1240,E2420100490111,西橋内中学校,三重県津市東古河町7-1,1,,,34.72069637,136.4999928,"地震〇津波※洪水〇土砂災害〇高潮〇火災×火山噴火×
※・・・津波警報等発令時は津波避難ビル又は津波避難ビルとして開設"
1241,E2420100492111,藤水出張所,三重県津市藤方1491-2,1,,,34.68548799,136.5100494,"地震〇津波×洪水〇土砂災害〇高潮×火災×火山噴火×
"
1242,E2420100493111,藤水小学校,三重県津市藤方1627,1,,,34.68979115,136.5120419,"地震〇津波※洪水〇土砂災害〇高潮〇火災×火山噴火×
※・・・津波警報等発令時は津波避難ビル又は津波避難ビルとして開設"
1243,E2420100495111,三重県立聾学校,三重県津市藤方2304-2,1,,,34.69407491,136.5176993,"地震〇津波※洪水〇土砂災害〇高潮〇火災×火山噴火×
※・・・津波警報等発令時は津波避難ビル又は津波避難ビルとして開設"
1244,E2420100507111,中勢用水中央管理事務所,三重県津市納所町524,1,,,34.72660152,136.4866176,地震〇津波〇洪水〇×砂災害〇高潮〇火災×火山噴火×
1245,E2420100512111,白山体育館,三重県津市白山町古市808,1,,,34.65088207,136.3408258,地震〇津波〇洪水〇土砂災害〇高潮〇火災×火山噴火×
1246,E2420100529111,倭小学校,三重県津市白山町上ノ村183,1,,,34.66743694,136.3353938,地震〇津波〇洪水〇土砂災害〇高潮〇火災×火山噴火×
1247,E2420100533111,元取公民館,三重県津市白山町城立305,1,,,34.62510693,136.2852558,地震〇津波〇洪水×土砂災害×高潮〇火災×火山噴火×
1248,E2420100539111,川口小学校,三重県津市白山町川口1991,1,,,34.64255323,136.3479619,地震〇津波〇洪水〇土砂災害〇高潮〇火災×火山噴火×
1249,E2420100552111,白山中学校,三重県津市白山町川口471-6,1,,,34.6442917,136.336755,地震〇津波〇洪水〇土砂災害〇高潮〇火災×火山噴火×
1250,E2420100557111,白山公民館,三重県津市白山町川口897,1,,,34.6390239,136.3401883,地震〇津波〇洪水〇土砂災害〇高潮〇火災×火山噴火× 
1251,E2420100560111,倭公民館,三重県津市白山町中ノ村581,1,,,34.66862048,136.3437381,地震〇津波〇洪水×土砂災害〇高潮〇火災×火山噴火×
1252,E2420100568111,家城小学校,三重県津市白山町南家城647,1,,,34.62740621,136.3138258, 地震〇津波〇洪水〇土砂災害〇高潮〇火災×火山噴火× 
1253,E2420100570111,家城公民館,三重県津市白山町南家城851-3,1,,,34.62658131,136.321536,地震〇津波〇洪水〇土砂災害〇高潮〇火災×火山噴火×
1254,E2420100572111,大三公民館,三重県津市白山町二本木1001-253,1,,,34.66599529,136.3707257,地震〇津波〇洪水〇土砂災害〇高潮〇火災×火山噴火×
1255,E2420100574121,介護老人保健施設　つつじの里,三重県津市白山町二本木1163,,,高齢者,34.667856,136.371065,
1256,E2420100574122,特別養護老人ホーム　きずな,三重県津市白山町二本木1163,,,高齢者,34.667745,136.37148,
1257,E2420100578111,大三小学校,三重県津市白山町二本木296,1,,,34.66403191,136.3731826,地震〇津波〇洪水〇土砂災害〇高潮〇火災×火山噴火×
1258,E2420100581121,特別養護老人ホーム　優美,三重県津市白山町二本木4009-3,,,高齢者,34.654168,136.367174,
1259,E2420100590111,八ツ山小学校,三重県津市白山町八対野2480,1,,,34.64913786,136.3269779,地震〇津波〇洪水〇土砂災害〇高潮〇火災×火山噴火×
1260,E2420100595111,八ツ山公民館,三重県津市白山町八対野994-1,1,,,34.64933776,136.3293061,地震〇津波〇洪水〇土砂災害〇高潮〇火災×火山噴火×
1261,E2420100598111,志登茂川浄化センター,三重県津市白塚町1592,1,,,34.772453053622,136.54160918938,"地震〇津波※洪水〇土砂災害〇高潮×火災×火山噴火×
※・・・津波警報等発令時は津波避難ビル又は津波避難ビルとして開設"
1262,E2420100600111,白塚小学校,三重県津市白塚町4463,1,,,34.76066475,136.5282668,"地震〇津波※洪水〇土砂災害〇高潮〇火災×火山噴火×
※・・・津波警報等発令時は津波避難ビル又は津波避難ビルとして開設"
1263,E2420100604111,新町小学校,三重県津市八町3-3-1,1,,,34.72083225,136.4924036,地震〇津波〇洪水〇土砂災害〇高潮〇火災×火山噴火× 
1264,E2420100605111,学校法人セントヨゼフ女子学園（第一体育館・第二体育館）,三重県津市半田1330,1,,,34.70340268,136.4976914,地震〇津波〇洪水〇土砂災害〇高潮〇火災×火山噴火×
1265,E2420100608111,津南防災コミュニティセンター,三重県津市半田3249-11,1,,,34.6924997970521,136.4911538777562,地震－津波〇洪水－土砂災害－高潮－火災×火山噴火×
1266,E2420100609111,三重県立津工業高等学校,三重県津市半田534,1,,,34.70969794,136.4977023,"地震〇津波※洪水〇土砂災害〇高潮〇火災×火山噴火×
※・・・津波警報等発令時は津波避難ビル又は津波避難ビルとして開設"
1267,E2420100610111,美杉小学校,三重県津市美杉町奥津1025,1,,,34.51179107,136.2664024,地震〇津波〇洪水〇土砂災害×高潮〇火災×火山噴火×
1268,E2420100612111,八幡地域住民センター,三重県津市美杉町奥津1288-8,1,,,34.51208804,136.2601413,地震〇津波〇洪水〇土砂災害×高潮〇火災×火山噴火×
1269,E2420100613111,八幡生活改善センター,三重県津市美杉町奥津1294,1,,,34.51138963,136.2606401,地震×津波×洪水〇土砂災害×高潮〇火災×火山噴火×
1270,E2420100616111,美杉高齢者生活福祉センター,三重県津市美杉町奥津929,1,,,34.51140891,136.268996,地震〇津波〇洪水〇土砂災害〇高潮〇火災×火山噴火×
1271,E2420100623111,下之川生活改善センター,三重県津市美杉町下之川1875,1,,,34.55506725,136.3400792,地震〇津波〇洪水×土砂災害×高潮〇火災×火山噴火×
1272,E2420100627111,美杉下之川体育館,三重県津市美杉町下之川6098-2,1,,,34.55764292,136.3425254,地震〇津波〇洪水×土砂災害×高潮〇火災×火山噴火×
1273,E2420100628111,下之川地域住民センター,三重県津市美杉町下之川6115,1,,,34.55730716,136.341946,地震〇津波〇洪水×土砂災害〇高潮〇火災×火山噴火×
1274,E2420100630111,多気地域住民センター,三重県津市美杉町上多気1031,1,,,34.51664358,136.3001163,地震〇津波〇洪水〇土砂災害〇高潮〇火災×火山噴火×
1275,E2420100631111,美杉多気体育館,三重県津市美杉町上多気1042-5,1,,,34.51684026,136.3000031,地震〇津波〇洪水×土砂災害×高潮〇火災×火山噴火×
1276,E2420100635111,美杉伊勢地体育館,三重県津市美杉町石名原1581-2,1,,,34.51354695,136.2383033,地震〇津波〇洪水×土砂災害×高潮〇火災×火山噴火×
1277,E2420100636111,伊勢地多目的集会所,三重県津市美杉町石名原1583,1,,,34.51377381,136.2378675,地震〇津波〇洪水〇土砂災害×高潮〇火災×火山噴火×
1278,E2420100637111,伊勢地地域住民センター,三重県津市美杉町石名原1681,1,,,34.51355137,136.2388827,地震〇津波〇洪水×土砂災害×高潮〇火災×火山噴火×
1279,E2420100646111,美杉高齢者婦人センター「しゃくなげ会館」,三重県津市美杉町川上3372,1,,,34.47947661,136.2658192,地震〇津波〇洪水〇土砂災害×高潮〇火災×火山噴火×
1280,E2420100651111,太郎生多目的集会所,三重県津市美杉町太郎生2120,1,,,34.53529613,136.1939196,地震〇津波〇洪水〇土砂災害×高潮〇火災×火山噴火×
1281,E2420100652111,（旧）太郎生小学校,三重県津市美杉町太郎生2128-1,1,,,34.53451517,136.1945881,地震〇津波〇洪水〇土砂災害×高潮〇火災×火山噴火×
1282,E2420100660111,丹生俣多目的集会所,三重県津市美杉町丹生俣1360-2,1,,,34.48918871,136.3032529,地震〇津波〇洪水×土砂災害〇高潮〇火災×火山噴火×
1283,E2420100667111,竹原コミュニティ防災センター,三重県津市美杉町竹原241-1,1,,,34.60088555,136.3099925,地震〇津波〇洪水×土砂災害×高潮〇火災×火山噴火×
1284,E2420100668111,竹原地域住民センター,三重県津市美杉町竹原2777,1,,,34.59431648,136.30504,地震〇津波〇洪水〇土砂災害〇高潮〇火災×火山噴火×
1285,E2420100669111,美杉竹原体育館,三重県津市美杉町竹原2796,1,,,34.59383086,136.3054962,地震〇津波〇洪水×土砂災害〇高潮〇火災×火山噴火×
1286,E2420100670111,竹原多目的集会所,三重県津市美杉町竹原2821,1,,,34.59472062,136.3054925,地震〇津波〇洪水×土砂災害〇高潮〇火災×火山噴火×
1287,E2420100679111,美杉総合文化センター,三重県津市美杉町八知5580-2,1,,,34.55593854,136.2623599,地震〇津波〇洪水〇土砂災害×高潮〇火災×火山噴火×
1288,E2420100680111,美杉中学校,三重県津市美杉町八知5800,1,,,34.55498405,136.2647516,地震〇津波〇洪水〇土砂災害〇高潮〇火災×火山噴火× 
1289,E2420100683121,特別養護老人ホーム　千年希望の杜美杉,三重県津市美杉町八知729-1,,,高齢者,34.582528,136.280358,
1290,E2420100688111,（旧）辰水小学校,三重県津市美里町家所2045,1,,,34.734184,136.409089,地震〇津波〇洪水〇土砂災害〇高潮〇火災×火山噴火×
1291,E2420100703121,特別養護老人ホーム　美里ヒルズ,三重県津市美里町三郷430,,,高齢者,34.724669,136.386347,
1292,E2420100704111,美里社会福祉センター,三重県津市美里町三郷46-3,1,,,34.72206395,136.3867355,地震〇津波〇洪水〇土砂災害〇高潮〇火災×火山噴火×
1293,E2420100706111,みさとの丘学園,三重県津市美里町三郷84,1,,,34.71894682,136.3869176,地震〇津波〇洪水〇土砂災害〇高潮〇火災×火山噴火×
1294,E2420100709111,（旧）高宮小学校,三重県津市美里町足坂585,1,,,34.720469,136.3917,地震〇津波〇洪水〇土砂災害×高潮〇火災×火山噴火×
1295,E2420100713111,（旧）長野小学校,三重県津市美里町北長野1435,1,,,34.744998,136.362479,地震〇津波〇洪水〇土砂災害×高潮〇火災×火山噴火×
1296,E2420100719111,櫛形出張所,三重県津市分部1192-1,1,,,34.73160533,136.4569984,地震〇津波〇洪水〇土砂災害〇高潮〇火災×火山噴火×
1297,E2420100720111,櫛形小学校,三重県津市分部1211-1,1,,,34.72951464,136.4560975,地震〇津波〇洪水〇土砂災害〇高潮〇火災×火山噴火×
1298,E2420100723111,櫛形市民館,三重県津市分部262-1,1,,,34.73863074,136.4641975, 地震〇津波〇洪水〇土砂災害〇高潮〇火災×火山噴火× 
1299,E2420100724111,片田出張所,三重県津市片田井戸町16-1,1,,,34.71032543,136.4429774,地震〇津波〇洪水〇土砂災害〇高潮〇火災×火山噴火×
1300,E2420100726111,片田小学校,三重県津市片田井戸町22,1,,,34.71136477,136.4423938,地震〇津波〇洪水〇土砂災害〇高潮〇火災×火山噴火×
1301,E2420100728121,障害者支援施設長谷山寮,三重県津市片田長谷町140-16,,,障がい者,34.726417,136.427066,
1302,E2420100729121,特別養護老人ホーム　慈宗院,三重県津市片田長谷町167-1,,,高齢者,34.726854,136.42574,
1303,E2420100730121,障害者支援施設津長谷山学園,三重県津市片田長谷町226,,,障がい者,34.728127,136.428876,
1304,E2420100739111,豊が丘小学校,三重県津市豊が丘2-34-1,1,,,34.808067,136.472685,地震〇津波〇洪水〇土砂災害〇高潮〇火災×火山噴火×
1305,E2420100746121,ベタニヤハウス,三重県津市豊が丘5-47-6,,,高齢者,34.806702,136.460042,
1306,E2420100747121,特別養護老人ホーム　アガペホーム,三重県津市豊が丘5-47-8,,,高齢者,34.806687,136.459624,
1307,E2420100765111,津市西部市民センター,三重県津市野田1-1,1,,,34.723709964624,136.46927385317,地震〇津波〇洪水〇土砂災害〇高潮〇火災×火山噴火×
1308,E2420100758121,ケアハウスしおりの里,三重県津市野田2033-1,,,高齢者,34.70929,136.462401,
1309,E2420100759121,（地域密着型）しおりの里　特別養護老人ホーム,三重県津市野田2035-2,,,高齢者,34.70892,136.462133,
1310,E2420100759122,しおりの里　広域型特別養護老人ホーム,三重県津市野田2035-2,,,高齢者,34.708986,136.462062,
1311,E2420100760121,特別養護老人ホーム　泉園,三重県津市野田2059,,,高齢者,34.710518,136.461472,
1312,E2420100762111,三重県立みえ夢学園高等学校,三重県津市柳山津興1239,1,,,34.70571739,136.5136494,"地震〇津波※洪水〇土砂災害〇高潮〇火災×火山噴火×
※・・・津波警報等発令時は津波避難ビル及び津波避難ビルとして開設"
1313,E2420100764111,阿漕塚記念館,三重県津市柳山津興632,1,,,34.70795825,136.5172062,地震〇津波×洪水×土砂災害〇高潮×火災×火山噴火×
1314,E2420100767121,特別養護老人ホーム　グリーンヒル,三重県津市緑が丘1-1-2,,,高齢者,34.714342,136.472055,
1315,E2447000002121,指定介護老人福祉施設特別養護老人ホームわたらい綠清苑,三重県度会町棚橋1202,,,高齢者,34.4387069787213,136.621539277486,
1316,E2447000002122,度会町地域福祉センター本所,三重県度会町棚橋1202,,,高齢者・障がい者,34.438317,136.621624,
1317,E2447000003111,保健センター,三重県度会町棚橋1215-1,1,,,34.43895,136.622432,
1318,E2447000005111,度会小学校体育館,三重県度会町棚橋1679-1,1,,,34.435393,136.618123,
1319,E2447000007111,度会中学校体育館,三重県度会町棚橋300,1,,,34.431885,136.62724,
1320,E2447000007112,町民体育館,三重県度会町棚橋300,1,,,34.432354,136.625883,
1321,E2447000008111,中央公民館,三重県度会町棚橋314,1,,,34.432687,136.625858,
1322,E2447000010111,小川郷体育館,三重県度会町中之郷1025,1,,,34.405692,136.603555,
1323,E2447000011111,中之郷生活改善センター,三重県度会町中之郷1157-5,1,,,34.405301,136.605852,
1324,E2447000013121,特別養護老人ホームかりん,三重県度会町田間319-18,,,高齢者,34.435692,136.600913,
1325,E2447000014121,度会町地域福祉センター一之瀬支所,三重県度会町南中村1956,,,高齢者,34.344476,136.592482,
1326,E2447000015122,小規模多機能型居宅介護わたらい,三重県度会町麻加江516-1,1,,高齢者,34.4373680325621,136.556626363768,
1327,E2447000015121,グループホームわたらい,三重県度会町麻加江516-1,1,,高齢者,34.4373813053892,136.556529804244,
1328,E2447000015111,中川体育館,三重県度会町麻加江516-1,1,,,34.437173,136.555982,
1329,E2447000016111,麻加江生活改善センター,三重県度会町麻加江603-2,1,,,34.437869,136.557581,
1330,E2447000017111,一之瀬公民館,三重県度会町脇出329,1,,,34.35095,136.587653,
1331,E2447000018111,一之瀬体育館,三重県度会町脇出372,1,,,34.351711,136.589726,
1332,E2432400001111,笹尾西小学校,三重県東員町笹尾西2-1-1,1,,,35.0999894503103,136.592523064485,洪水〇　崖崩れ等〇　地震〇　大規模な火事〇　内水氾濫〇
1333,E2432400015111,笹尾コミュニティセンター,三重県東員町笹尾東2-5-3,,,,35.099238,136.596742,洪水〇　崖崩れ等〇　地震〇　大規模な火事〇　内水氾濫〇
1334,E2432400003111,笹尾東小学校,三重県東員町笹尾東4-28,1,,,35.102065826219,136.603149186529,洪水〇　崖崩れ等〇　地震〇　大規模な火事〇　内水氾濫〇
1335,E2432400004111,城山小学校,三重県東員町城山1-48,1,,,35.0907955550637,136.60548167112,洪水〇　崖崩れ等〇　地震〇　大規模な火事〇　内水氾濫〇
1336,E2432400005111,東員第二中学校,三重県東員町城山2-1,1,,,35.1004707701469,136.603465530789,洪水〇　崖崩れ等〇　地震〇　大規模な火事〇　内水氾濫〇
1337,E2432400006121,東員町保健福祉センター,三重県東員町大字山田1600,,,要配慮者,35.074451,136.583603,洪水〇　崖崩れ等〇　地震〇　大規模な火事〇　内水氾濫〇
1338,E2432400006112,東員共同福祉施設,三重県東員町大字山田1600,,,,35.074039,136.585357,洪水〇　崖崩れ等〇　地震〇　大規模な火事〇　内水氾濫〇
1339,E2432400006111,東員町総合体育館,三重県東員町大字山田1600,,,,35.0735345294553,136.584872231294,洪水〇　崖崩れ等〇　地震〇　大規模な火事〇　内水氾濫〇
1340,E2432400014111,東員町総合文化センター,三重県東員町大字山田1700,,,,35.073228,136.586436,洪水〇　崖崩れ等〇　地震〇　大規模な火事〇　内水氾濫〇
1341,E2432400013121,東員町ふれあいセンター,三重県東員町大字山田2013,,,妊産婦、乳児、特に配慮が必要な幼児とその介助者,35.075075,136.585049,洪水〇　崖崩れ等〇　地震〇　大規模な火事〇　内水氾濫〇
1342,E2432400008111,稲部小学校,三重県東員町大字大木944,1,,,35.0832176377703,136.574616076106,洪水〇　崖崩れ等〇　地震〇　大規模な火事〇　内水氾濫〇
1343,E2432400009111,三和小学校,三重県東員町大字長深700,1,,,35.0648285711711,136.577341273273,洪水✕　崖崩れ等〇　地震〇　大規模な火事〇　内水氾濫✕
1344,E2432400011111,神田小学校,三重県東員町大字六把野新田100,1,,,35.0784275129946,136.592803061975,洪水〇　崖崩れ等〇　地震〇　大規模な火事〇　内水氾濫〇
1345,E2432400012111,東員第一中学校,三重県東員町大字六把野新田557,1,,,35.0794990500619,136.600387319925,洪水〇　崖崩れ等〇　地震〇　大規模な火事〇　内水氾濫〇
1346,E2447200003111,南部体育館,三重県南伊勢町阿曽浦222,,,,34.274166,136.583242,
1347,E2447200007111,阿曽浦合同ビル,三重県南伊勢町阿曽浦60,1,,,34.276782,136.581473,
1348,E2447200019111,旧穂原学校,三重県南伊勢町伊勢路1005,,,,34.344668,136.642501,
1349,E2447200026111,伊勢路多目的集会施設,三重県南伊勢町伊勢路1523-1,1,,,34.353697,136.643775,
1350,E2447200035111,押渕コミュニティセンター,三重県南伊勢町押渕1073-1,,,,34.326871,136.629044,
1351,E2447200040111,下津浦生活改善センター,三重県南伊勢町下津浦895,,,,34.335593,136.727023,
1352,E2447200043111,林渓寺,三重県南伊勢町河内428,,,,34.28986,136.510213,
1353,E2447200048111,古和浦防災センター,三重県南伊勢町古和浦1141-1,,,,34.257499,136.459816,
1354,E2447200051111,大納生活改善センター,三重県南伊勢町古和浦542-2,,,,34.266567,136.460529,
1355,E2447200055111,南伊勢町保育所　五ケ所園,三重県南伊勢町五ケ所浦1060,,,,34.351748,136.699614,
1356,E2447200058111,南伊勢町福祉健康ランド,三重県南伊勢町五ケ所浦2928,,,,34.351167,136.705874,
1357,E2447200059111,南伊勢町立南勢小学校,三重県南伊勢町五ケ所浦3755-4,,,,34.349474,136.708888,
1358,E2447200063111,南勢体育センター,三重県南伊勢町五ケ所浦907-2,,,,34.35122,136.700004,
1359,E2447200066111,斎田多目的集会施設,三重県南伊勢町斎田774-2,1,,,34.344335,136.63336,
1360,E2447200068111,始神コミュニティセンター,三重県南伊勢町始神154,1,,,34.335341,136.623098,
1361,E2447200070111,宿浦コミュニティセンター,三重県南伊勢町宿浦1114-5,1,,,34.300827,136.690161,
1362,E2447200072121,旧南島西中学校体育館,三重県南伊勢町小方竈,1,,主として、高齢者、障がい者、乳幼児その他の特に配慮を要する者,34.262008,136.48061,
1363,E2447200088111,神津佐高齢者コミュニティセンター,三重県南伊勢町神津佐950,,,,34.3463251060815,136.731609913667,
1364,E2447200090111,切原教育集会所,三重県南伊勢町切原455,,,,34.360898,136.708176,
1365,E2447200091111,切原コミュニティセンター,三重県南伊勢町切原693-1,1,,,34.362182,136.711075,
1366,E2447200103111,南伊勢町立南勢中学校,三重県南伊勢町船越2100,,,,34.35036,136.686605,
1367,E2447200212121,おひさま保育園,三重県南伊勢町船越2688,,,乳幼児や障がい者など保護者の介助が必要で、一般の避難所での生活が難しい世帯,34.349504,136.688661,
1368,E2447200110111,ふれあいと体験の館”海ぼうず”,三重県南伊勢町相賀浦371-1,1,,,34.292824,136.649492,
1369,E2447200142111,南伊勢町保育所　宿田曽園,三重県南伊勢町田曽浦3802,,,,34.297083,136.693053,
1370,E2447200143112,宿田曽体育館,三重県南伊勢町田曽浦3813,,,,34.296812,136.692555,
