840,E2420400121111,漕代地区市民センター,三重県松阪市早馬瀬町279-2,1,,,34.54352825,136.588876,
841,E2420400122111,大河内地区市民センター,三重県松阪市大河内町796,1,,,34.52504895,136.4760728,
842,E2420400123111,朝見小学校（体育館）,三重県松阪市大宮田町195,1,,,34.57061776,136.5739613,
843,E2420400124111,朝見地区市民センター,三重県松阪市大宮田町209-4,1,,,34.57122661,136.5742957,
844,E2420400128111,花岡地区市民センター,三重県松阪市大黒田町1235-2,1,,,34.5629992,136.5204702,
845,E2420400129111,花岡小学校（体育館）,三重県松阪市大黒田町757,1,,,34.55969702,136.522021,
846,E2420400130122,コープみえ　デイサービス松阪,三重県松阪市大黒田町847-7,,,要配慮者,34.561159238341,136.52013600925,
847,E2420400132111,松阪牛の里オーシャンファーム武道館,三重県松阪市大足町1064,1,,,34.566023881432,136.50802945799,
848,E2420400133121,メディカルガーデン松阪,三重県松阪市大津町849,,,要配慮者,34.566495599472,136.54958093863,
849,E2420400134111,港地区市民センター,三重県松阪市大平尾町629-1,1,,,34.593492,136.537552,
850,E2420400135111,松尾小学校（体育館）,三重県松阪市丹生寺町566,1,,,34.54995072,136.4931632,
851,E2420400136111,松尾地区コミュニティセンター,三重県松阪市丹生寺町605,1,,,34.549574,136.4929078,
852,E2420400141111,三雲中学校（体育館）,三重県松阪市中道町345,1,,,34.62068103,136.5137887,
853,E2420400198121,あしたばデイヒルズ,三重県松阪市朝日町一区17-8,,,要配慮者,34.580684216013,136.53862711226,
854,E2420400148121,ふれあいの里つじわら,三重県松阪市辻原町97-3,,,要配慮者,34.514048642455,136.45501180834,
855,E2420400149111,幸小学校（体育館）,三重県松阪市殿町1198-2,1,,,34.57196674,136.5233892,
856,E2420400150111,第一小学校（体育館）,三重県松阪市殿町1349-1,1,,,34.57631357,136.5294206,
857,E2420400151111,松阪工業高等学校（体育館）,三重県松阪市殿町1417,1,,,34.57224192,136.5267635,
858,E2420400152111,殿町中学校（体育館）,三重県松阪市殿町1508-1,1,,,34.57486114,136.5234871,
859,E2420400153121,デイサービス　あろは,三重県松阪市田村町1183-1,,,要配慮者,34.548681723853,136.51042307306,
860,E2420400213121,デイサービスセンター　やまさくら,三重県松阪市田村町235-1,,,要配慮者,34.556989060096,136.51255456845,
861,E2420400206122,介護付き有料老人ホーム　「シルバーハウス松阪」,三重県松阪市田村町447-1,,,,34.558567,136.511943,
862,E2420400206121,住宅型有料老人ホーム　シルバーハウス松阪,三重県松阪市田村町447-1,,,要配慮者,34.558704979359,136.51139641997,
863,E2420400155111,第二隣保館,三重県松阪市東町15-2,1,,,34.57521243,136.5472214,
864,E2420400157111,粟野コミュニティセンター,三重県松阪市飯高町粟野589,1,,,34.419311641319,136.25404695818,管理担当連絡先は平常時の施設管理者ではなく松阪市役所防災対策課
865,E2420400158111,宮前小学校（体育館）,三重県松阪市飯高町宮前1022,1,,,34.43451315,136.3343234,
866,E2420400218121,はーとりあ飯高,三重県松阪市飯高町宮前197,,,要配慮者,34.428441690853,136.3338288416,
867,E2420400159111,老人福祉センター,三重県松阪市飯高町宮前704-2,1,,,34.431817898908,136.33577759035,
868,E2420400160111,飯高中学校（体育館）,三重県松阪市飯高町宮前927,1,,,34.4347585,136.3337431,
869,E2420400161111,旧飯高西中学校（体育館）,三重県松阪市飯高町宮本216,1,,,34.40152294,136.2204554,
870,E2420400202121,小規模特別養護老人ホームきらり,三重県松阪市飯高町宮本字天王谷305,,,要配慮者,34.401568435013,136.22097257936,
871,E2420400162111,Ｂ＆Ｇ海洋センター,三重県松阪市飯高町七日市834,1,,,34.40923894,136.2243454,
872,E2420400163111,総合開発センター,三重県松阪市飯高町七日市850,1,,,34.408982245933,136.22368553083,
873,E2420400164111,保健センター,三重県松阪市飯高町森1407,1,,,34.38743133,136.2171419,
874,E2420400165111,香肌小学校（体育館）,三重県松阪市飯高町森1810-2,1,,,34.386908,136.2218766,
875,E2420400166122,うぃるグループホーム飯高,三重県松阪市飯高町森2126-1,,,要配慮者,34.37966910923,136.22237240079,
876,E2420400167111,グランドゴルフ場,三重県松阪市飯高町森2199-1,1,,,34.378644381383,136.22197272129,
877,E2420400168111,林業総合センター,三重県松阪市飯高町波瀬148,1,,,34.42157158,136.1418722,
878,E2420400169111,たんぽぽの丘,三重県松阪市飯高町富永72-1,1,,,34.41296343,136.2362602,
879,E2420400170111,飯南ひまわりこども園,三重県松阪市飯南町横野839,1,,,34.47247779,136.3954876,
880,E2420400171111,飯南産業文化センター,三重県松阪市飯南町横野848,1,,,34.471697785062,136.39536222293,
881,E2420400172111,飯南体育センター,三重県松阪市飯南町横野867,1,,,34.47220822,136.3947871,
882,E2420400174111,ふれあいセンター,三重県松阪市飯南町横野885,1,,,34.471916,136.394247,
883,E2420400175121,小規模特別養護老人ホームさくら橋,三重県松阪市飯南町粥見1693-1,,,要配慮者,34.451282081552,136.40579274704,
884,E2420400176111,飯南コミュニティセンター,三重県松阪市飯南町粥見3910-1,1,,,34.451219487513,136.39068846469,
885,E2420400177111,粥見小学校（体育館）,三重県松阪市飯南町粥見3969,1,,,34.44985258,136.3910309,
886,E2420400178111,飯南たんぽぽこども園,三重県松阪市飯南町粥見4018,1,,,34.4495421,136.3894186,
887,E2420400179121,老人保健施設さくらんぼ,三重県松阪市飯南町粥見5471-18,,,要配慮者,34.445642005829,136.37598805827,
888,E2420400205111,飯南高等学校（体育館）,三重県松阪市飯南町粥見5480-1,1,,,34.447742,136.372492,
889,E2420400180111,飯南中学校（体育館）,三重県松阪市飯南町粥見566,1,,,34.4615209,136.4015666,
890,E2420400201121,小規模多機能型居宅介護事業所　夢の元気村,三重県松阪市飯南町向粥見249,,,要配慮者,34.439485646452,136.37390804662,
891,E2420400181111,上仁柿コミュニティ消防センター,三重県松阪市飯南町上仁柿1597-1,1,,,34.48462908,136.3626281,
892,E2420400182111,有間野小学校（休校）,三重県松阪市飯南町有間野1064,1,,,34.43643053,136.3516399,管理担当連絡先は平常時の施設管理者ではなく、松阪市役所防災対策課
893,E2420400217121,みくもホーム,三重県松阪市肥留町589-1,,,要配慮者,34.637274987887,136.51386100297,
894,E2420400225121,セントケア看護小規模松阪,三重県松阪市宝塚町720-6,,,要配慮者,34.554586,136.517705,
895,E2420400184111,櫛田地区市民センター,三重県松阪市豊原町1118-1,1,,,34.548203545637,136.5831239135,
896,E2420400185111,揥水小学校（体育館）,三重県松阪市豊原町1120,1,,,34.54776555,136.5820075,
897,E2420400186111,松阪商業高等学校（体育館）,三重県松阪市豊原町1600,1,,,34.54608577,136.5677793,
898,E2420400187111,漕代小学校（体育館）,三重県松阪市目田町207,1,,,34.53856633,136.5877025,
899,E2420400188111,大河内小学校（体育館）,三重県松阪市矢津町1775,1,,,34.53151303,136.4757775,
900,E2420400189111,うきさと憩センター,三重県松阪市柚原町38,1,,,34.53833164,136.3920597,
901,E2420400189112,宇気郷地区市民センター,三重県松阪市柚原町38,1,,,34.53835815,136.3918237,
902,E2420400190111,中部中学校（体育館）,三重県松阪市立野町1344,1,,,34.5477763,136.5098338,
903,E2420400191111,三十三銀行アリーナ（松阪市総合体育館）,三重県松阪市立野町1370,1,,,34.544704139804,136.50808431085,
904,E2420400207121,放課後等デイサービスあい,三重県松阪市立野町567-1,,,要配慮者,34.548463766618,136.50364585912,
905,E2420400192111,機殿小学校（体育館）,三重県松阪市六根町16,1,,,34.56861925,136.5998182,
906,E2420400193111,機殿地区市民センター,三重県松阪市六根町885-2,1,,,34.56829671,136.5990538,
907,E2434400001111,川越町総合体育館,三重県川越町亀崎新田77-546,1,,,35.0105201895626,136.683340123456,
908,E2434400003111,亀崎地区公民館,三重県川越町亀崎新田83-6,1,,,35.0226535365839,136.692182823912,
909,E2434400005111,亀須地区公民館,三重県川越町亀須新田278-5,1,,,35.0306643151746,136.689898217729,
910,E2434400006111,上吉地区公民館,三重県川越町高松1301,1,,,35.0126132936279,136.679188417131,
911,E2434400008111,川越南小学校,三重県川越町高松258,1,,,35.0223218791521,136.666109118334,
912,E2434400009111,高松地区公民館,三重県川越町高松380-1,1,,,35.0178878349549,136.671971084009,
913,E2434400026121,よつばの里,三重県川越町大字亀崎新田21-11,,町が受入調整した者,身体障害者、精神障害者、知的障害者,35.023693,136.687073,
914,E2434400025121,かわごえよつばの里,三重県川越町大字亀崎新田21-12,1,町が受入調整した者,身体障害者、精神障害者、知的障害者,35.023539,136.687223,
915,E2434400013111,南福崎地区公民館,三重県川越町南福崎405,1,,,35.01963197741,136.678003059832,
916,E2434400014111,三重県立川越高等学校,三重県川越町豊田2303-1,1,,,35.0279880846179,136.666283917266,
917,E2434400015111,天神地区公民館,三重県川越町豊田373-2,1,,,35.0139646496003,136.661685784806,
918,E2434400017111,豊田地区公民館,三重県川越町豊田927-1,1,,,35.0228839122701,136.661217046083,
919,E2434400010121,川越町いきいきセンター,三重県川越町豊田一色314,1,,要配慮者,35.026021062464,136.67103735283,
920,E2434400010111,川越町あいあいセンター,三重県川越町豊田一色314,1,,,35.0263329560762,136.670307791969,
921,E2434400020111,豊田一色地区公民館,三重県川越町豊田一色320,1,,,35.025882420919,136.670257418688,
922,E2434400021111,川越中学校,三重県川越町豊田一色67,1,,,35.0252787124475,136.670522368121,
923,E2434400022111,川越北小学校,三重県川越町豊田一色69,1,,,35.0236500046429,136.669864588334,
924,E2434400023111,北福崎地区公民館,三重県川越町北福崎45-1,1,,,35.0311102260039,136.678234340687,
925,E2444100001111,津田小学校体育館,三重県多気町井内林138,1,,,34.5009654661133,136.513261901861,
926,E2444100002111,津田地区公民館,三重県多気町井内林894-1,1,,,34.5004993945145,136.515462847529,
927,E2444100003111,相可小学校体育館,三重県多気町兄国464,1,,,34.5108670596913,136.555818738568,
928,E2444100004111,相可地区公民館,三重県多気町兄国808-4,1,,,34.5105162607454,136.555524180843,
929,E2444100005111,天啓の里,三重県多気町四疋田587-1,1,,,34.495491,136.535239,
930,E2444100006111,外城田小学校体育館,三重県多気町森荘534-1,1,,,34.4842178059987,136.577457442337,
931,E2444100007111,外城田地区公民館,三重県多気町森荘570-1,1,,,34.4845541780261,136.577559479401,
932,E2444100008111,佐奈地区公民館,三重県多気町仁田12,1,,,34.4807138709781,136.545287469348,
933,E2444100009111,佐奈小学校体育館,三重県多気町仁田120,1,,,34.4819803117099,136.547197301736,
934,E2444100010112,多気中学校第１体育館,三重県多気町相可1540,1,,,34.4997687724772,136.544988093454,
935,E2444100010111,多気中学校第２体育館,三重県多気町相可1540,1,,,34.4985132076428,136.546345291218,
936,E2444100018111,ＢＡＮＫＹＯ文化会館,三重県多気町相可1587-1,1,,,34.495946,136.547252,
937,E2444100011111,Ｄｒｅａｍオーシャントレーニングセンター,三重県多気町相可1608,1,,,34.4951889433047,136.547148727053,
938,E2444100012111,相可高校体育館,三重県多気町相可50,1,,,34.5044957887966,136.5363821577,
939,E2444100013111,勢和東公民館,三重県多気町丹生1807,1,,,34.4802192696318,136.48907286819,
940,E2444100014111,ささゆり苑,三重県多気町朝柄2889,1,,,34.4588835445244,136.462534690501,
941,E2444100015111,勢和公民館,三重県多気町朝柄3127-2,1,,,34.4612806803208,136.459438304418,
942,E2444100016111,勢和中学校体育館,三重県多気町片野2254,1,,,34.4648626106673,136.458815364899,
943,E2444100017111,勢和小学校体育館,三重県多気町片野2343,1,,,34.4635976745878,136.460177927079,
944,E2447100017111,多目的センターふるさと館（七保公民館）,三重県大紀町永会3838,1,,,34.393782045788,136.47177716878,
945,E2447100045111,大紀町役場錦支所,三重県大紀町錦736-7,1,,,34.222522148526,136.39583344959,
946,E2447100046111,錦あおぞら保育園,三重県大紀町錦788-10,1,,,34.222812,136.394448,
947,E2447100048111,錦みなとホール,三重県大紀町錦795,1,,,34.222610860885,136.39507706664,
948,E2447100054111,山海の郷紀勢（和室・喫茶室）,三重県大紀町崎2154-1,1,,,34.29728748809,136.39896399456,
949,E2447100055111,コンベンションホール,三重県大紀町崎2200-1,1,,,34.297362676408,136.39957029703,
950,E2447100065111,七保小学校体育館,三重県大紀町打見388,1,,,34.41209035038,136.48095103974,
951,E2447100066111,やまびこ広場,三重県大紀町大内山1917,1,,,34.261263438675,136.34398272239,
952,E2447100071111,中央公民館（大内山公民館）,三重県大紀町大内山849-3,1,,,34.275502730474,136.35741277896,
953,E2447100072111,大内山Ｂ＆Ｇ海洋センター体育館,三重県大紀町大内山853-2,1,,,34.275666744976,136.35826035701,
954,E2447100073111,大内山健康福祉センターいきいきプラザ,三重県大紀町大内山861-1,1,,,34.275288551349,136.35779932275,
955,E2447100074111,大紀小学校講堂,三重県大紀町大内山875,1,,,34.275131127819,136.35869164341,
956,E2447100078111,大宮小学校体育館,三重県大紀町滝原1748-1,1,,,34.349976617576,136.40838194021,
957,E2447100080111,大宮中学校体育館,三重県大紀町滝原1889-7,1,,,34.350720669151,136.4064185632,
958,E2444300001112,大台町健康ふれあい会館,三重県大台町粟生1010,1,,,34.414933,136.468775,
959,E2444300001111,大台町地域福祉センター,三重県大台町粟生1010,1,,,34.414875,136.468489,
960,E2444300002111,粟生公民館,三重県大台町粟生347,1,,,34.416462,136.466493,
961,E2444300003111,下三瀬集会所,三重県大台町下三瀬553-2,1,,,34.401127,136.427189,
962,E2444300004111,真手地域総合センター,三重県大台町下真手1301-1,1,,,34.377627,136.367762,
963,E2444300005111,下楠集会所,三重県大台町下楠389,1,,,34.42113905,136.4844448,
964,E2444300006111,大杉谷地域防災コミュニティーセンター,三重県大台町岩井291,1,,,34.298259,136.221163,
965,E2444300007111,大杉谷地域総合センター,三重県大台町久豆199,1,,,34.278689,136.217052,
966,E2444300008111,久豆生活改善センター,三重県大台町久豆348-3,1,,,34.2798340358997,136.211910564813,
967,E2444300009111,熊内集会所,三重県大台町熊内208-1,1,,,34.363278,136.3166937,
968,E2444300010111,栗谷生活改善センター,三重県大台町栗谷212-1,1,,,34.385663,136.302141,
969,E2444300057121,大台町介護老人保健施設みやがわ,三重県大台町江馬114,,,高齢者,34.364193,136.339495,
970,E2444300011111,宮川福祉センター,三重県大台町江馬122,1,,,34.363708,136.33869,
971,E2444300058121,特別養護老人ホーム　やまびこ荘,三重県大台町江馬269,,,高齢者,34.365066,136.336496,
972,E2444300012111,大台町林業総合センター,三重県大台町江馬316,1,,,34.362003,136.335399,
973,E2444300013111,大台町生活改善センター,三重県大台町江馬701,1,,,34.362363,136.331194,
974,E2444300014111,高奈集会所,三重県大台町高奈260-1,1,,,34.407872,136.462761,
975,E2444300015111,大台町就業改善センター,三重県大台町佐原1019,1,,,34.394543,136.405359,
976,E2444300016111,佐原集会所,三重県大台町佐原442-3,1,,,34.396686,136.406802,
977,E2444300017111,小切畑生活改善センター,三重県大台町小切畑1000,1,,,34.367168,136.345447,
978,E2444300018111,領内地域防災コミュニティーセンター,三重県大台町小滝171-3,1,,,34.344347,136.285888,
979,E2444300019111,上三瀬公民館,三重県大台町上三瀬450-5,1,,,34.400752,136.420865,
980,E2444300020111,大台中学校,三重県大台町上三瀬903-1,1,,,34.398396,136.415029,
981,E2444300021111,上真手集会所,三重県大台町上真手416-2,1,,,34.374878,136.364294,
982,E2444300022111,上菅集会所,三重県大台町上菅467,1,,,34.38539519,136.3808858,
983,E2444300023111,上楠コミュニティセンター,三重県大台町上楠241-7,1,,,34.419609,136.472408,
984,E2444300024111,川添保育園,三重県大台町上楠409-1,1,,,34.421524,136.474113,
985,E2444300025111,川添小学校,三重県大台町上楠420,1,,,34.421122,136.473334,
986,E2444300026111,日進公民館,三重県大台町新田239-1,1,,,34.439036,136.518341,
987,E2444300027111,日進小学校,三重県大台町新田278,1,,,34.438934,136.521216,
988,E2444300028111,神瀬集会所,三重県大台町神瀬266,1,,,34.432612,136.493347,
989,E2444300029111,川合集会所１,三重県大台町菅合1204,1,,,34.385105,136.405569,
990,E2444300031111,大台町老人憩の家,三重県大台町菅合2206,1,,,34.354805,136.402005,
991,E2444300032111,三瀬谷認定こども園,三重県大台町菅合2960,1,,,34.38773,136.404076,
992,E2444300033111,下菅集会所,三重県大台町菅合316-11,1,,,34.38552,136.390559,
993,E2444300034111,清水集会所,三重県大台町清滝485-1,1,,,34.36613271,136.36093,
994,E2444300035111,千代集会所,三重県大台町千代959,1,,,34.44617,136.547083,
995,E2444300055121,特別養護老人ホーム大台共生園,三重県大台町千代997,,,高齢者,34.445048,136.548606,
996,E2444300036111,大滝農構センター,三重県大台町大ケ所291-2,1,,,34.35704,136.41035,
997,E2444300037111,大杉谷林間キャンプ村（民芸館）,三重県大台町大杉159-21,1,,,34.275807,136.196447,
998,E2444300038111,長ケ集会所,三重県大台町長ケ831-1,1,,,34.386682,136.439635,
999,E2444300039111,唐櫃生活改善センター,三重県大台町唐櫃340-1,1,,,34.35043,136.300885,
1000,E2444300056121,愛の家　グループホーム大台,三重県大台町栃原1147-2,,,高齢者,34.437208,136.506608,
1001,E2444300040111,宮野集会所,三重県大台町栃原1249-2,1,,,34.44550781,136.5089873,
1002,E2444300041111,グリーンプラザおおだい,三重県大台町栃原1691-1,1,,,34.434959,136.5132157,
1003,E2444300042111,大台町町民体育館（旧協和中学校）,三重県大台町栃原1692-1,1,,,34.434678,136.513094,
1004,E2444300043111,日進保育園,三重県大台町栃原1868-2,1,,,34.43472178,136.5123592,
1005,E2444300044111,本郷公民館,三重県大台町栃原618,1,,,34.444996,136.517664,
1006,E2444300045111,南集会所,三重県大台町南333-1,1,,,34.340424,136.281053,
1007,E2444300046111,桧原集会所,三重県大台町桧原455-6,1,,,34.294183,136.22491,
1008,E2444300047111,本田木屋生活改善センター,三重県大台町本田木屋150-3,1,,,34.368808,136.357883,
1009,E2444300048111,明豆集会所,三重県大台町明豆348-2,1,,,34.358821,136.3038767,
1010,E2444300049111,茂原集会所,三重県大台町茂原351-6,1,,,34.358317,136.3322837,
1011,E2444300050111,昴学園高校,三重県大台町茂原48,1,,,34.3603531640513,136.336582229569,
1012,E2444300051111,宮川中学校,三重県大台町茂原643-8,1,,,34.356399,136.329304,
1013,E2444300052111,大台町Ｂ＆Ｇ海洋センター,三重県大台町弥起井363,1,,,34.389058,136.397473,
1014,E2444300053111,弥起井集会所,三重県大台町弥起井373-2,1,,,34.39038962,136.3962545,
1015,E2444300054111,柳原集会所,三重県大台町柳原634-1,1,,,34.440648,136.543665,
1016,E2434300001111,向陽台公民館,三重県朝日町向陽台2-1-9,1,,,35.038478413057,136.65390862384,
1017,E2434300002111,柿公民館,三重県朝日町大字柿2050,1,,,35.033433861515,136.65833344916,
1018,E2434300003111,朝日町体育館,三重県朝日町大字柿2146,1,,,35.035170847989,136.65904719492,
1019,E2434300004111,朝日町教育文化施設,三重県朝日町大字柿2278,1,,,35.036726587114,136.65922281019,
1020,E2434300007111,朝日中学校,三重県朝日町大字柿2838,1,,,35.038231062269,136.65262985878,
1021,E2434300010111,朝日小学校,三重県朝日町大字柿750,1,,,35.033743296422,136.66542658176,
1022,E2434300011111,朝日町公民館,三重県朝日町大字小向1893,1,,,35.036743401741,136.66094953852,
1023,E2434300013111,小向公民館,三重県朝日町大字小向849-4,1,,,35.035321737327,136.66529357269,
1024,E2434300014121,朝日町保健福祉センター,三重県朝日町大字小向891-5,1,,避難行動要支援者のうち、個別計画の作成に同意し、当該施設に避難を希望する者,35.034572722302,136.66412750422,
1025,E2434300022111,朝日ヶ丘公民館,三重県朝日町大字縄生2591-27,1,,,35.043538,136.668251,
1026,E2434300015111,縄生公民館,三重県朝日町大字縄生714-1,1,,,35.043065,136.672765,
1027,E2434300017111,埋縄公民館,三重県朝日町大字埋縄994,1,,,35.031567971998,136.64810023741,
1028,E2434400024111,当新田地区公民館,三重県朝日町縄生1142-1,1,,,35.034431690129,136.68154719855,
1029,E2434300018111,白梅西公民館,三重県朝日町白梅の丘西1-8-3,1,,,35.042137740221,136.65868049026,
1030,E2434300020111,白梅東集会所,三重県朝日町白梅の丘東2-12-12,1,,,35.038935982704,136.66133589838,
1031,E2421100001111,鳥羽シーサイドホテル,三重県鳥羽市安楽島町1084,1,,,34.478933318771,136.85167030689,
1032,E2421100002111,亀の井ホテル　鳥羽,三重県鳥羽市安楽島町1200-7,1,,,34.47473742,136.8510169,
1033,E2421100004111,鳥羽東中学校,三重県鳥羽市安楽島町1451-19,1,,,34.464141723219,136.84939229539,
1034,E2421100005112,鳥羽高校武道場,三重県鳥羽市安楽島町1459,1,,,34.465559,136.84837,
1035,E2421100005111,鳥羽高校体育館,三重県鳥羽市安楽島町1459,1,,,34.46611142,136.8487803,
1036,E2421100006111,安楽島保育所,三重県鳥羽市安楽島町1459-1,1,,,34.464238147791,136.84876500174,
1037,E2421100008111,安楽島小学校,三重県鳥羽市安楽島町377,1,,,34.462964226664,136.85902499815,
1038,E2421100010111,安楽島公民館２階,三重県鳥羽市安楽島町844-4,1,,,34.46387611,136.8703518,
1039,E2421100011121,特別養護老人ホームあらしま苑,三重県鳥羽市安楽島町字高山1075-58,,左記について、施設の受け入れ体制が整い次第、各避難所で避難生活が困難で支援が必要な被災者がいる場合に開設します。,高齢者,34.474897,136.858591,
1040,E2421100014111,本浦公民館,三重県鳥羽市浦村町1237,1,,,34.44430976,136.8889505,
1041,E2421100017111,旧鏡浦小学校,三重県鳥羽市浦村町1744-1,1,,,34.446235,136.900246,
1042,E2421100019111,今浦老人憩の家,三重県鳥羽市浦村町240,1,,,34.44082901,136.8799152,
1043,E2421100020111,河内公民館,三重県鳥羽市河内町75-1,1,,,34.445206,136.83573,
1044,E2421100021111,加茂中学校,三重県鳥羽市岩倉町105,1,,,34.44818953188,136.84075353672,
1045,E2421100022111,みどりが丘集会所,三重県鳥羽市岩倉町1144-120,1,,,34.450536351231,136.84299563493,
1046,E2421100023111,加茂小学校,三重県鳥羽市岩倉町27-1,1,,,34.444895493414,136.84435402328,
1047,E2421100024121,特別養護老人ホーム鳥羽陽光苑,三重県鳥羽市岩倉町609,1,左記について、施設の受け入れ体制が整い次第、各避難所で避難生活が困難で支援が必要な被災者がいる場合に開設します。,高齢者,34.442754,136.848426,
1048,E2421100025111,旧堅子公民館２階,三重県鳥羽市堅子町124,1,,,34.384998886623,136.87308585477,
1049,E2421100026111,鳥羽小学校,三重県鳥羽市堅神町805-2,1,,,34.47892986,136.819833,
1050,E2421100027111,堅神公民館,三重県鳥羽市堅神町815,1,,,34.479787982726,136.82076760145,
1051,E2421100029111,相差保育所,三重県鳥羽市国崎町140,1,,,34.415979071681,136.92368506406,
1052,E2421100032111,坂手公民館,三重県鳥羽市坂手町135,1,,,34.48562563875,136.86015375138,
1053,E2421100036111,坂手コミュニティアリーナ,三重県鳥羽市坂手町935,1,,,34.48636218,136.8609526,
1054,E2421100037111,若杉公民館,三重県鳥羽市若杉町10-40,1,,,34.452777955677,136.84225260273,
1055,E2421100041111,湯快リゾート　鳥羽彩朝楽,三重県鳥羽市小浜町610,1,,,34.5011892554508,136.834655198058,
1056,E2421100042111,旧小浜小学校２階以上,三重県鳥羽市小浜町97,1,,,34.49837366,136.8334932,
1057,E2421100044111,松尾公民館,三重県鳥羽市松尾町644-3,1,,,34.431906475098,136.84179806566,
1058,E2421100045111,なごみ,三重県鳥羽市松尾町651-2,1,,,34.432087857077,136.84175514962,
1059,E2421100049111,神島開発総合センター２階以上,三重県鳥羽市神島町85-2,1,,,34.54998338,136.9804991,
1060,E2421100050111,菅島小学校,三重県鳥羽市菅島町1-2,1,,,34.4985242,136.8995376,
